Video_ID,Title,Uploader,Duration_Sec,Views,Tags,Lyrics,Emotion_Label
VprRQ1UHdnc,Hoàng Thuỳ Linh x Karik x Hoà Phát | Kiềng Ba Chân (Official Music Video),Hoàng Thùy Linh,239,13687987,"hoang thuy linh, hoàng thuỳ linh, thuỳ linh, banh troi nuoc, bánh trôi nước, hoàng, the leader entertainment, để mị nói cho mà nghe, gieo quẻ, see tình, kẻ cắp gặp bà già, duyên âm, em đây chẳng phải thúy kiều, kiềng ba chân, kieng ba chân, kiềng 3 chân, kieng 3 chan, kiềng ba chân hoàng thùy linh, kieng ba chan hoang thuy linh, kiềng 3 chân hoàng thùy linh, kieng 3 chan hoang thuy linh, kiềng 3 chân karik, kieng 3 chan karik, kieng ba chan karik, karik hoàng thùy linh","👷Ôi ôi ối~ Em vừa chuẩn bị xong rồi | Trông xinh xắn, hôm nay giao diện không tồi | Mưa nắng âu cũng do là duyên trời | Không hên xui, mong mọi thứ luôn tuyệt vời ☺️ | Em vẫn luôn là 1️⃣ trên đời | Luôn uy tín, không để ai phải nghĩ ngợi | Vui tính, nên là hay làm chủ cuộc chơi | Nhưng đôi khi trên sóng không hay nhiều lời | Người ta nói em chẳng bao giờ dễ đoán 😎 | Chẳng hề theo ai dẫn lối chỉ nghe trái tim mình muốn gì | Người ta nói em vẫn hay nhiều tính toán 🤔 | Vấp ngã rồi, đứng lên rồi và dần chạm lên giấc mơ | Dù ai nói ngả nói nghiêng, nói ngả nói nghiêng cứ nói ngả nói nghiêng | Thì ta cứ đi là đi, đã đi là đi không nói thêm điều gì | Dù ai có ngả có nghiêng, có ngả có nghiêng có có ngả có nghiêng | Thì ta vẫn luôn vững vàng, vẫn luôn bền lâu như là kiềng ba chân | 🎵🎵🎵 | 👷‍♂️Hôm nay thua thì mai làm lại thôi | Đừng để đam mê từ nay phải nguôi ngoai | Vì đường thành công luôn chông gai và ít khi nào mọi lời đều xuôi tai (Ok) | Đâu ai muốn tương lai bị chôn vùi | Thà chậm xíu còn hơn là bước lùi | Giờ thì tiến lên thôi , cùng nhiệt huyết lên ngôi | Đến khi mọi việc xong xuôi (oh oh) | Thất bại là mẹ thành công, bạn ơi đừng quá hoang mang | Gian nan thử thách thì ta tìm cách luồn lách gian nan | Như kiềng 3 chân , vững vàng với đam mê | Mọi lời khen chê luôn là tiền đề , để ta bước sang trang | Vì không có khó khăn nào vững bền | Khi niềm tin vẫn luôn ở sát bên | 7 lần ngã hết 8 lần đứng lên | Rồi một ngày không xa vinh quang sẽ xướng…tên (yeah) | 👷 Chắc chắn, con đường đi còn rất dài | Chắc chắn, trên đường có nhiều chướng ngại | Em luôn thế, không cần không cần quan ngại | Luôn đi sớm, không sợ sai | Còn nhiều top trending chờ lên, sao lại quay đầu | Nhiều đỉnh núi cao chưa đặt tên, đang chờ in dấu | Nếu lo xa hay sợ thất bại | Làm sao để biết ta là ai!? | Người ta nói em chẳng bao giờ dễ đoán | Chẳng hề theo ai dẫn lối chỉ nghe trái tim mình muốn gì | Người ta nói em vẫn hay nhiều tính toán | Vấp ngã rồi, đứng lên rồi và dần chạm lên giấc mơ | Dù ai nói ngả nói nghiêng, nói ngả nói nghiêng cứ nói ngả nói nghiêng | Thì ta cứ đi là đi, đã đi là đi không nói thêm điều gì | Dù ai có ngả có nghiêng, có ngả có nghiêng có có ngả có nghiêng | Thì ta vẫn luôn vững vàng, vẫn luôn bền lâu như là kiềng ba chân | Dù ai nói ngả nói nghiêng, nói ngả nói nghiêng cứ nói ngả nói nghiêng | Thì ta cứ đi là đi, đã đi là đi không nói thêm điều gì | Dù ai có ngả có nghiêng, có ngả có nghiêng có có ngả có nghiêng | Thì ta vẫn luôn vững vàng, vẫn luôn bền lâu như là kiềng ba chân",
Ou6O0N1uAko,Đỏ Là Dấu Ấn - Orange x Liu Grace x Masew | OFFICIAL MV,Orange Singer Official,249,13672369,"cam, cam hat ai nghe, do la dau an orange, orange, orange cover, orange karaoke, orange liu grace, orange liu grace masew, orange live, orange masew, orange mv, Đỏ Là Dấu Ấn, đỏ là dấu ấn, đỏ là dấu ấn orange, đỏ đấu ấn liu grace",Không có lời bài hát (Sub),
5Jm9g0YdGDU,Thái Bình Mồ Hôi Rơi - Sơn Tùng M-TP,Sơn Tùng M-TP Official,319,13653858,"son tung, sơn tùng, sơn tùng mtp, son tung mtp, mtp, M-TP, son tung thai binh mo hoi roi, sơn tùng thái bình hồ hôi rơi, thai binh mo hoi roi son tung, thái bình mồ hôi rơi sơn tùng",Không có lời bài hát (Sub),
ih3Uen1NQSk,Huyền Thoại | The Legend - Phan Mạnh Quỳnh [OFFICIAL MV],Phan Mạnh Quỳnh Official,291,13650149,"phan mạnh quỳnh, phan manh quynh, huyền thoại, huyen thoai, mv huyền thoại, mv huyen thoai, mv huyền thoại phan mạnh quỳnh, mv huyen thoai phan manh quynh, the legend phan manh quynh, the legend phan mạnh quỳnh, huyền thoại the legend phan mạnh quỳnh, huyen thoai the legend phan manh quynh, huyen thoai official mv, huyền thoại official mv, phan manh quynh official, phan mạnh quỳnh official, OFFICIAL MV, Huyền Thoại | The Legend, Phan Mạnh Quỳnh [OFFICIAL MV]","Chiếc nón lá che ngang hai đứa: khô | Tấm áo trắng thôi không bay nữa | hồi ức về em còn | hình bóng của em còn | Hằng đêm nuốt lấy bóng trăng giữa sương mù | phút chốc thấy ta giống như nhẹ bớt ngày u hoài | cay đắng và điên dại. | Hồn ta mong lướt ánh sáng trong cõi mơ về phía em | khi thuyền đến  nơi nàng có trông thấy ta? | Kêu van thiết tha em vẫn cứ xa | chốn lạ ta thấy mình | Vật vờ như hồn ma! | Thương ai? Nhớ ai? | Em là nỗi đau nhưng êm dịu | ta là nắng chiều | sắp thành bóng đêm chẳng còn người trông theo | chẳng còn gì bám víu. | Cô đơn, tủi hờn | đang giày xéo nơi xác thân tàn | sao nàng im lặng | ôi lạnh lẽo ta đi tìm bụi sao băng | ta thành kẻ buôn trăng… | Lúc mới biết yêu cô thôn nữ | chưa nên lời | Lãng khách luyến lưu  nhưng mắc cỡ | do đó mà trong lòng | vương vấn làn hương nồng. | Và vầng trăng đi theo ta từ khi ấy | buông tơ thành mắt môi nàng | cho đêm cô quạnh ôm lấy thi nhân | thổn thức và bẽ bàng | người xuống vội đò ngang. | Hồn ta mong lướt ánh sáng trong cõi mơ về phía em | nhưng thuyền đứng im nơi trái tim chính ta | Kêu van thiết tha | Em vẫn cứ xa | chốn lạ ta thấy mình.. | Vật vờ như hồn ma! | Thương ai?  Nhớ ai? | Em là nỗi đau nhưng êm dịu | Ta là nắng chiều | sắp thành bóng đêm chẳng còn người trông theo | chẳng còn gì bám víu | Cô đơn, tủi hờn | đang giày xéo nơi xác thân tàn | sao nàng im lặng | ôi lạnh lẽo ta đi tìm bụi sao băng | ta thành kẻ buôn trăng… | ""Mơ khách đường xa khách đường xa | Áo em trắng quá nhìn không ra | Ở đây sương khói mờ nhân ảnh | Ai biết tình ai | Ai biết tình ai có... | đậm đà?"" | Thương ai? Nhớ ai? | Em là nỗi đau nhưng êm dịu | Ta là nắng chiều | sắp thành bóng đêm chẳng còn người trông theo | chẳng còn gì bám víu | Cô đơn, tủi hờn | đang giày xéo nơi xác thân tàn | sao nàng im lặng | ôi lạnh lẽo ta đi tìm bụi sao băng | ta thành kẻ buôn trăng | ta thành kẻ buôn trăng...!",
LPx7ERqFYM0,"15. Badtrip - RPT MCK | ""99%"" the album",MCK // Nger,159,13639278,"rpt mck, mck, nger, MCK, RPT MCK, ""99%"" the album, album 99%, album mck, intro, tintro album 99%, 99 phần trăm, 99%, mck 99%, mck mới nhất, mck album mới nhất, mck moi nhat, mck full album, 99% full album, full album mck, chìm sâu, suit & tie, suit and tie, mck tlinh, mck osad, mck rpt, mck nger, rpt mck rap việt, rapital mck, mck diss osad, badtrip, badtrip mck, badtrip mv, badtrip mv lyric, badtrip lyric, badtrip lofi, bad trip karaoke","(Pretty Boy) | (P-p-p-phongkhin) | Lại rót thêm cốc bia nhưng mà lười cạn | Thành công tao đánh đổi bằng những người bạn | Thành công tao đánh đổi bằng cả hạnh phúc | Vẫn đặt lên đôi môi một nụ cười tạm | Tao chọn giữ nỗi buồn làm của riêng tao | Tao thả nó như mưa từ trên trời xuống | Chắp tay lạy phật chỉ là chiêm bao | Ngửa cổ lên trời tao được mời uống | Tao đã không tin vào bản thân | Tao đã từng tin vào con số | Yea tao luôn tin vào tình yêu | Nó đến và nó đi như 1 cơn gió | Vẫn luôn là em ngày hôm đó, | Mùi hương này phảng phất vào trong gió | Em có muốn xem thế giới của anh? | Nó chứa đầy giông tố! | Nó sẽ không chỉ có mỗi âm nhạc | Nó có cả thuốc đỏ và cả bông gạc | Có những tờ xanh dương đã bị đâm toạc | Để anh nhìn cho thật rõ mấy thằng phông bạt | Để anh nhìn cho thật rõ là ảo ảnh | Để anh chiêm nghiệm thêm mỗi khi vào cảnh | Nhận ra ai là bạn tốt đến khi cần thiết | Nhận ra ai tìm niềm vui đến khi nào rảnh | Và tao sẽ không nói tao chỉ quan sát | Ngắm những tia nắng lấp lánh, tràn vào căn gác | Say **** với tất cả những thứ bad vibe, cho vào ngăn rác (cho vào ngăn rác) | Họ sẽ làm phim về cuộc đời tao, năm này qua năm khác (năm này qua năm khác) | Chúng nó cứ nhìn cách tao thành công trong đầu chúng nó tưởng là khá dễ (easy) | Chúng nó bất ngờ khi tao vượt lên nhưng mà lúc đấy thì đã quá trễ | Thứ giết chúng ta chính là kỉ niệm thứ không thay đổi được là kí ức | Thứ làm ta nhớ là những bài học thứ cần thay đổi là cái ý thức | Lại rót thêm cốc bia nhưng mà lười cạn | Thành công tao đánh đổi bằng những người bạn | Thành công tao đánh đổi bằng cả hạnh phúc | Vẫn đặt lên đôi môi một nụ cười tạm | Tao chọn giữ nỗi buồn làm của riêng tao | Tao thả nó như mưa từ trên trời xuống | Chắp tay lạy phật chỉ là chiêm bao | Ngửa cổ lên trời tao được mời uống | Và con người (con người) | Họ tưởng là họ xấu nhưng mà họ không (no) | Chọn cách xả bản thân vào những thứ trần tục | Phần ác và phần thiện luôn muốn đọ công | Họ không thể kiểm soát một cách thuần thục | Và mà khi mà thể xác đã bị vấy bẩn (vấy bẩn) | Thì tâm hồn một phần cũng bị vẩn đục | Vì khi mà giọt nước đã tràn ly thì tao sẵn sàng giao chiến kể cả mày có cầm lục | (Glock) | (Blackout) | Tao đấm vào mặt mày đến khi mày Blackout! | Vì mỗi một con người đều có riêng một giới hạn | Nếu mày vượt qua giới hạn đừng có trách tao (Okay) | Và tao chỉ đang muốn hưởng trọn vẹn kiếp sống này vì tao nhận ra sự hữu hạn của tuần hoàn | Tao muốn được cười tươi kể cả khi bần hàn | Tao đã nhận ra việc mình cần làm | Chắp tay, | Lạy Phật (Tôn trọng) | Con đến với thế giới không phải vì tham | Con muốn được là con, được khóc được cười | Được thăm thú, tận hưởng tất cả kì quan | Con muốn được tự hào về bản sắc, | Máu đỏ và da vàng bởi vì con là người VIỆT NAM | Và con vẫn luôn biết mình sẽ mãi không cô độc | Dù cho tâm trí con bị biệt giam | Lại rót thêm cốc bia nhưng mà lười cạn | Thành công tao đánh đổi bằng những người bạn | Thành công tao đánh đổi bằng cả hạnh phúc | Vẫn đặt lên đôi môi một nụ cười tạm | Tao chọn giữ nỗi buồn làm của riêng tao | Tao thả nó như mưa từ trên trời xuống | Chắp tay lạy phật chỉ là chiêm bao | Ngửa cổ lên trời tao được mời uống | &lt;3",
GtmrOux7rgg,Wxrdie - 0 AI NGHĨ [feat. @MachiotOfficial],Wxrdie,186,13607173,"wxrdie, wxrdie 0 ai nghĩ, 0 ai nghĩ, 0 ai nghĩ wxrdie, wxrdie tlinh, wxrdie mck, wxrdie dizz mck, wxrdie dizz tlinh, wxrdie tlinh mck, wxrdie 0 ai nghi, 0 ai nghi, khong ai nghĩ, không ai nghĩ wxrdie, wxrdie không ai nghĩ, wxrdie khong ai nghi, 0 ai nghi wxrdie, wxrdie khong ai nghi lyric, lyric khong ai nghi wxrdie, lyric 0 ai nghi wxrdie, tlinh wxrdie, tlinh neu luc do, wxrdie tlinh neu luc do, wxrdie tlinh nếu lúc đó, mck tlinh wxrdie, mck wxrdie tlinh",Không có lời bài hát (Sub),
3uo4LucubTU,KHÓC HUYNH ĐỆ | Audio Lyric | OST BI LONG ĐẠI CA 2021,A TÔ FILM,293,13597569,"a to making film, đạo diễn a to, phim giang hồ, phim hành động, khóc huynh đệ, nhạc phim ato, nhạc phim giang hồ, nhac phim hay nhat, tuyển tập nhạc phim trung quốc hay nhất, tuyển tập nhạc phim, nhạc phim người trong giang hồ, nhạc hoa lời việt, tuyển tập nhạc hoa lời việt, nhạc phim hong kong, khi bạn cần có tôi đây, nhạc phim hong kong thap nien 90, khi ban can co toi day, nhac anh em giang ho, khoc huynh de, nhạc phim bi long đại ca, bi long đại ca, huynh đệ ơi",Không có lời bài hát (Sub),
9PHY8aAflNE,"CẦM KỲ THI HOẠ -Bích Phương, Tiên Tiên, Lamoon, Phương Mỹ Chi, Bảo Anh |Em Xinh Say Hi [Performance]",Vie Channel - MUSIC,305,13589875,"htv2, vie channel, music vie channel, Em Xinh, em xinh say hi, Em Xinh ""Say Hi"", Em Xinh Say Hi, em xinh say hi mới nhất, em xinh say hi 2025, Em Xinh ""Say Hi"" 2025, em xinh say hi 2025 mới nhất, em xinh say hi tập 2, tập 2 em xinh say hi, cầm kỳ thi họa em xinh say hi, cầm kỳ thi hoạ, cam ky thi hoa, cầm kỳ thi hoạ team bích phương, team bích phương, tiên tiên, bảo anh, phương mỹ chi, cam ky thi hoa live performance, cam ky thi hoa performance, tien tien",Không có lời bài hát (Sub),
Eq3vNfS7EHU,CƯỚI NHAU LÀ ĐÚNG BÀI - NHẬT KIM ANH FT NGUYỄN ĐÌNH VŨ | NHẬT KIM ANH LIFE,Nhật Kim Anh Life,210,13548325,"nhat kim anh, nhật kim anh, nhat kim anh official, mv nhật kim anh, mv nhat kim anh, nhạc nhật kim anh, nhac nhat kim anh, nhat kim anh remix, nhac mien tay, nhạc miền tây, miền tây, mien tay, luc tinh mien tay, 13 tỉnh miền tây, 13 tinh mien tay, cưới nhau là đúng bài, nhạc đám cưới, nhac dam cuoi, nhac dam cuoi mien tay, nhạc đám cưới miền tây",Không có lời bài hát (Sub),
MAxdSC64BP0,Wxrdie - TRỞ VỀ (ft. JustaTee) [prod. by Phongkhin] | OFFICIAL MV,Wxrdie,358,13521970,"wxrdie, trở về, trở về wxrdie, wxrdie trở về, wxrdie mới nhất, wxrdie playlist, nhạc wxrdie, rap, trở về mv, trở về wxrdie mv, trở về lyrics, trở về wxrdie lyrics, trở về beat, trở về wxrdie beat, tro ve, justatee, wxrdie justatee, justatee wx, trở về justatee, justatee nhạc tết, tim anh ghen, nu cep, moi em, băng qua cầu giấy, get money, the wxrdies, wxrdie album","Con đã lớn lên ở trên nôi, ở trên nôi mẹ | Nghe tiếng hát ru ca ối a | Con đã lớn lên nơi mưa giông, nơi mưa giông | Đủ biết từng điều mẹ đã mãi cho đi | Mẹ uống nước lã, uống nước lã để phần con thịt cá | Càng đi để tự mình thấy nhỏ bé với những thứ mẹ đã trải qua | Và giấu đi chỉ để đổi lấy lời nói dối con nghe | Có những lúc phải đi xa, nhưng mà con chỉ muốn được trở về | Có những lúc nghĩ sẽ buông xuôi, | nhưng mà con lại nhớ về bố mẹ | Nhớ giọng bố gọi con là cún ơi vang tận ra ngoài ngõ | Nhớ bàn tay của mẹ vẫn chở che, vẫn hay thường vỗ về | Đòi mẹ sắm cho bộ loa, bảo là con thích được nghe nhạc | Đòi bố mua cho 2 anh em cặp xe, | vì bọn con rất thích đạp xe đạp | Dù chẳng đáp ứng được hết | nhưng bố vẫn luôn trìu mến và nhẹ nhàng | Nắng gió vẫn đón đưa con đi mặc cho mẹ đã bị trễ làm | Nhìn vào mắt bố con đã thấy | những giọt nước mắt bố giấu trong bẽ bàng | Nhìn vào mắt mẹ con đã thấy | những giấc mơ đang trôi qua thật khẽ khàng | Mọi thứ vốn bình yên, nhưng rồi ai mà biết là nó lại rẽ làn | Con chỉ muốn trả lại thanh xuân cho bố mẹ, | dù biết điều này chẳng dễ dàng | Và con sẽ bước tiếp dù biết phía trước nó sẽ chẳng dễ dàng | Chỉ cần bố mẹ yên lòng thôi, bất cứ điều gì con cũng sẽ làm | Tất cả những đàm tiếu về ta gom luôn vào đây con xé toạc | Dù biết là sẽ chẳng dễ dàng, nhưng vì bố mẹ con zai sẽ làm | Con sẽ làm | Đáp xuống Nội Bài, trong vali con là đống quà | Rót chén nước, thắp nén hương, | thằng cu cháu mời các cụ về thăm nhà | Năm tháng trôi qua để lại những nếp nhăn trên tay của ông bà | Nhớ nồi bánh chưng mỗi dịp Tết, và nhớ cái vị của cơm cà | Nhớ mấy cây phong lan ông bô hay ngắm nghía ở sân nhà | Nhớ mấy đứa em ngoan, vẫn còn ngây ngô giờ đã đều lớn cả | Dù có đi xa, khi trở về nhà, thì vẫn cứ là phải vâng dạ | Có đi xa, khi trở về nhà, thì vẫn cứ là phải vâng dạ | Trăng sáng nên hôm nay, con lại viết tiếp thêm 1 bài | Mong rằng có thể xua tan đi hết bao muộn phiền | Chăm sóc con từng ngày, để giờ con cất cánh tung bay | Vẫn về đây dù cho con có kiếm cả bộn tiền | Đã có lúc thất bại, chẳng thể nào khiến con lung lay | Con còn phải tập trung xử lý nốt mấy đầu việc | Và những nghĩ suy này lại, làm từng dòng thơ cứ thế một dài | Con lại thu vào mic tựa như những lời cầu nguyện | Có những lúc phải đi xa, nhưng mà con chỉ muốn được trở về | Có những lúc nghĩ sẽ buông xuôi, | nhưng mà con lại nhớ về bố mẹ | Có những lúc phải đi xa, nhưng mà con chỉ muốn được trở về | Có những lúc nghĩ sẽ buông xuôi, | nhưng mà con lại nhớ về bố mẹ | Cho con, cho con, cho con cả cuộc đời | đằng sau lời nói dối kia | Mẹ đã cho con, cho con, cho con, cho con | Đi về nơi đâu để trở lại đây | Cho con, cho con, cho con cả cuộc đời | đằng sau lời nói dối kia | Mẹ đã cho con, cho con, cho con, cho con | Đi về nơi đâu để trở lại đây | Cho con, cho con, cho con cả cuộc đời | đằng sau lời nói dối kia | Mẹ đã cho con, cho con, cho con, cho con | Đi về nơi đâu để trở lại đây | Cho con, cho con, cho con cả cuộc đời | đằng sau lời nói dối kia | Mẹ đã cho con, cho con, cho con, cho con",
V1v5mAOgTJg,nếu một mai tôi bay lên trời - hứa kim tuyền x trúc nhân (from album 'Colours'),Hứa Kim Tuyền,270,13494416,"hứa kim tuyền, hua kim tuyen, trúc nhân, truc nhan, nếu một may tôi bay lên trời, neu mot mai toi bay len troi, nếu một mai tôi bay lên trời trúc nhân, neu mot mai toi bay len troi truc nhan",Không có lời bài hát (Sub),
dLaJRXiDU24,Sol7 - Back To Hometown - Team Binz | Rap Việt - Mùa 2  [MV Lyrics],Vie Channel ,210,13483208,"htv2, vie channel, vie giai tri, giai tri tv, trấn thành, binz, karik, underground, wowy, rhymastic, touliver, the rapper, rapper việt, việt rap, mua 2 rap viet, team karik, team binz, team wowy, team rhymastic, rap việt season 2, rap việt mùa 2, mùa 2, lk, rap việt full, lk rap viet, rap việt mùa 3 tập 2, tập 3 rap việt mùa 2, rap việt mùa 3 full, rap viet season 2, rap việt tập 3 htv2, j jade, sol7, back to hometown, thầy 7, bồng sơn, bồng sơn sol7, đêm nay anh mơ về em",Không có lời bài hát (Sub),
hGi0-P81vEc,KHI CÔ ĐƠN EM NHỚ AI (LOFI MUSIC) - VICKY NHUNG x LONG REX | CHILL WITH VICKY NHUNG (SEASON 2),Vicky Nhung,258,13478813,"chill with vicky nhung, chill witk vicky nhung season 2, lofi music, vicky nhung lofi, nhạc hoa lofi, khi cô đơn em nhớ ai nhạc hoa, khi cô đơn em nhớ ai lofi, lofi khi cô đơn em nhớ ai, khi cô đơn em nhớ ai Vicky Nhung, vicky nhung khi cô đơn em nhớ ai, khi em thấy cô đơn lòng em nhớ ai, người yêu ơi em biết không vẫn say đắm trong lòng, Từng giọt mưa long lanh xôn xao, khi co don em nho ai lofi, khi co don em nho ai vicky nhung, đặt bàn tay lên khóe môi, khi co don em nho ai",♪ Từng giọt mưa long lanh xôn xao | ♪ Để mộng mơ trong em bay cao | ♪ Em đâu biết tình này dạt dào | ♪ Phố xá thênh thang khi đêm về mơ lúc vai kề | ♪ Vẫn thấy miên man từng đêm những cơn mê | ♪ Nhẹ nhàng ru trong đêm thâu | ♪ Lung linh cơn mưa ngâu | ♪ Mưa gieo mãi làm gì giọt sầu | ♪ Hỡi trái tim cô đơn lạc loài hãy nở nụ cười | ♪ Để thấy quanh em tình yêu vẫn có đôi | ♪ Đặt bàn tay lên khóe môi | ♪ Chiếc hôn vẫn xa vời | ♪ Đêm vẫn lạnh lùng dù qua phố đông | ♪ Người yêu ơi em biết không | ♪ Vẫn say đắm trong lòng | ♪ Dù thời gian trôi xa tình vẫn trao người thiết tha | ♪ Khi em thấy cô đơn lòng em nhớ ai | ♪ Anh mong bước chân em về trong nắng mai | ♪ Đừng mang bóng đêm vô tình | ♪ Về vây kín trong tâm hồn | ♪ Hãy nghe trái tim hát lời yêu thương | ♪ Từng giọt mưa long lanh xôn xao | Để mộng mơ trong em bay cao | ♪ Em đâu biết tình này dạt dào | ♪ Phố xá thênh thang khi đêm về mơ lúc vai kề | ♪ Vẫn thấy miên man từng đêm những cơn mê | ♪ Nhẹ nhàng ru trong đêm thâu | ♪ Lung linh cơn mưa ngâu | ♪ Mưa gieo mãi làm gì giọt sầu | ♪ Hỡi trái tim cô đơn lạc loài hãy nở nụ cười | ♪ Để thấy quanh em tình yêu vẫn có đôi | ♪ Đặt bàn tay lên khóe môi | ♪ Chiếc hôn vẫn xa vời | ♪ Đêm vẫn lạnh lùng dù qua phố đông | ♪ Người yêu ơi em biết không | ♪ Vẫn say đắm trong lòng | ♪ Dù thời gian trôi xa tình vẫn trao người thiết tha | ♪ Khi em thấy cô đơn lòng em nhớ ai | ♪ Anh mong bước chân em về trong nắng mai | ♪ Đừng mang bóng đêm vô tình | ♪ Về vây kín trong tâm hồn | ♪ Hãy nghe trái tim còn vẫn nhớ thương | ♪ Khi em thấy cô đơn lòng em nhớ ai | ♪ Anh mong bước chân em về trong nắng mai | ♪ Đừng mang bóng đêm vô tình về vây kín trong tâm hồn | ♪ Hãy nghe trái tim hát lời yêu thương | ♪ Đừng mang bóng đêm vô tình về vây kín trong tâm hồn | ♪ Hãy nghe trái tim hát lời yêu thương,
H1J75wSu-ZQ,Mình Từng Yêu Nhau - Phan Mạnh Quỳnh | AUDIO LYRIC,Phan Mạnh Quỳnh Official,276,13460713,"mình từng yêu nhau phan mạnh quỳnh, minh tung yeu nhau phan manh quynh, minh tung yeu nhau, Mình từng yêu nhau, Phan mạnh quỳnh official, phan mạnh quỳnh channel, xa kỷ niệm, mình từng yêu nhau lyric, phan mạnh quỳnh, phan manh quynh, phan manh quynh official, mình từng yêu nhau phan mạnh quỳnh audio, minh tung yeu nhau phan manh quynh audio, mình từng yêu nhau audio, minh tung yeu nhau audio, mình từng yêu nhau video lyric, minh tung yeu nhau lyric, mình từng yêu nhau",Không có lời bài hát (Sub),
