Video_ID,Title,Uploader,Duration_Sec,Views,Tags,Lyrics,Emotion_Label
Blk1GXDM7gA,Tiếng Chày Trên Sóc Bom Bo | HKT | Official MV,POPS MUSIC,283,24654847,"Ca Khuc, Ca Khuc Nhac Tre Hay Nhat 2015, HKT, Lien Khuc Nhac Tre 2015, Nhac, Nhac Hay Nhat, Nhac Hot Nhat, Nhac Lang Man, Nhac Moi Nhat, Nhac Nghe Nhieu Nhat, Nhac Remix, Nhac That Tinh, Nhac Tinh Yeu, Nhac Tinh Yeu 2015, Nhac Tre, Nhac Tre Hot Nhat 2015, Nhac Tre Moi Nh",Không có lời bài hát (Sub),
CsCgX0Cm44g,2323 - NGHIÊM TỔNG prod. MAI CẢNH DỊ & ĐẠI TRƯỢNG FU,MCK // Nger,173,24626942,"rpt mck, mck, nger, MCK, RPT MCK, 2323, 2323 mck, đánh đổi, mck 2323, mck mới nhất, tháp drill tự do, đánh đổi karaoke, obito, tại vì sao, mộng yu, nhạc rap mck, mck rap, rap viet, nhac rap moi nhat, mck 2323 official, mck nger","Cứ quên anh vậy đi | Nhạt nhoà sương tan, ái ân, mây trôi buồn | Những môi hôn chìm sâu | Còn đâu nụ cười thơ ngây đó? | Cứ xa anh vậy đi | Đường mòn xưa kia dẫn lối đôi chân lẻ loi, | oh-oh, oh-oh-oh-oh | Anh lẻ loi | Mưa rơi nhẹ rơi, mưa đừng mang hoàng hôn xua tan bóng em | Chua cay nào hay? Thương là đau, màn đêm chia hai giấc mơ | Giọt nước mắt vô tâm thờ ơ | Ngàn câu ca sao nghe hững hờ? | Em lặng im, anh lặng im | Sương gió bủa vây | Ooh-ooh-ooh, ooh-ooh-ooh-ooh | Ngày tháng êm ấm vụt mất | Ai đó mang em đi rồi giấu chôn những hoài mong | Ở phía trước mong em bình yên phía sau những vụn vỡ | Cơn gió quay lưng rồi ngoái thương những chờ mong | anh đã khác em cũng khác uh hmn i kno that baby gurl | người yêu cũ của e ghen với anh vì anh flow ác baby gurl | bảo nó out ra khỏi hình luôn đi đứng vào hình chỉ làm tăng contrast | thích thì chơi đấm vào đầu mày 2 phát, 2 x 2 pap pap pap pap | trai tráng nam nhi đại trượng phu nháy mắt cul cul anh sợ đéo cái phốt ghẻ | trông em tươi tắn, ưng con ngươi lắm | trông em tươi tắn, ưng con ngươi lắm 1 chốt yêu luôn 2 chốt đẻ | mấy thằng anh em cả mấy thằng em anh, dạy anh biết đời thế nào là fair | không tin may mắn anh tin vào anh đại cát đại hung ra chùa là đốt quẻ | uh huh anh em bọn a cứ thế thôi | uh huh anh lặng im chẳng nói được đâu nào anh hóa đá anh tê rồi | uh huh anh em bọn a cứ thế thôi | bao quanh anh ngực công mông thủ | tiêu chuẩn cao chỉ đẹp không đủ | Buông đôi tay nhau ra buông đôi tay nhau ra | Mình em xin nhất trong tim này | Ai đó mang em đi rồi vấn vương những hoài mong | Ở phía trước mong em bình yên phía sau những vụn vỡ | Cơn gió quay lưng rồi ngoái thương những chờ mong",
BurYzEr9CpA,Anh Không Đòi Quà - OnlyC ft Karik | Official Music Video,AVATAR Entertainment,199,24570486,,Không có lời bài hát (Sub),
ycMYhQsifTI,Lưu Luyến Sau Chia Tay - Try92 ft. Kai06 | Official Lyrics Video,DACI Entertainment,347,24554658,"luu luyen sau chia tay, lưu luyến sau chia tay, luu luyen sau chia tay lyric, lưu luyến sau chia tay lyric, lưu luyến sau chia tay lyrics, lưu luyến sau chia tay try92, em có quen người nào chưa, em có quen nguoi nao chua sao moi toi tan ca khong thay ai don dua, em có quên người nào chưa sao mỗi tối anh chẳng thấy ai đón đưa, daci, daci entertainment, chang, chang lyrics",Không có lời bài hát (Sub),
ED_arGt3TQY,Bài Ca Chung Dzui - Da LAB x Lay's (Official Music Video),Da LAB Official,239,24351956,"da lab anhemrap, rap hip hop, Da LAB, bài ca chung vui, bai ca chung vui, bài ca, chung vui, dalab, dalab mv, nhạc dalab, dalab album, nhung bai hat cua dalab, mv dalab, dalab 2022, dalab lofi, nhạc mới nhất dalab, bài ca chung vui dalab, bai ca chung vui dalab, dalab bài ca chung vui, mv bài ca chung vui, rap, bài ca chung dui, bai ca chung dui, bài ca chung dzui, bài ca tuổi trẻ, nhạc trẻ, nhạc trẻ mới nhất, nhạc hay mới nhất, tuổi trẻ này mình cùng nhau",Không có lời bài hát (Sub),
SCUo9vYSu6g,VSTRA - Internet Love (ft. Tyronee) | Official M/V,VSTRA,219,24149308,"hnhngan, cdsl, cdsl music, hạnh ngân, hanh ngan, hanhngan, internet love, internet love hnhngan, internet, internet love lyrics, internet love video, hnhngan internet love, internet hnhngan, obito hanh ngan, hnhngan obito, hnhngan va obito, hnhngan và obito, obito, tyronee, internet love mv, internet love music video, ghosting vstra cover, ghosting vstra, như viên đường vstra demo, demo vstra như viên đường, ghosting linh ka cover",Không có lời bài hát (Sub),
BhbETPFyuaY,CÓ NGƯỜI (SOMEONE) - VŨ CÁT TƯỜNG | OFFICIAL MV,Vũ Cát Tường (VCT),282,24091708,"có người, co nguoi, Nhac Vu Cat Tuong, có người vũ cát tường, co nguoi vu cat tuong, someone vu cat tuong, inner me vu cat tuong, co nguoi inner me, có người inner me, mv có người, mv co nguoi, mv vũ cát tường, có người audio, vũ cát tường có người, vu cat tuong co nguoi, cát tường, vũ cát tường 2019, bài mới của vũ cát tường, mv, SOMEONE, SOMEONE MV, VŨ CÁT TƯỜNG MV",Chiều nay có người | Hẹn anh với nụ cười tươi | Chiều nay có người | Hẹn anh với nụ cười tươi | Chiều nay có người | Dạy anh cách làm mặt vui | Dường như anh cũng đã quen rồi | Ngày và đêm chỉ công việc thôi | Người chợt đến như ánh mặt trời | Xoa dịu đi vết thương | Có người nói anh xấu thế nào | Khi nhìn anh ăn lúc chưa no | Có người nói anh khó thế nào | Khi nhìn gương mặt anh đắn đo | Có người nói anh ấm thế nào | Khi ùa đến cuộn trong cánh tay anh | Có người cho anh biết thế nào | Là dành một đời để yêu một người | Giờ một mình một trời nơi xa | Buồn vì để lại đôi ta | Vẫn cẩn thận để dành tất cả | Niềm vui niềm thương dù anh phải đi xa | Từng hạt mưa như xé mây trời | Ngồi lặng im nén lòng tả tơi | Chiều nay không còn những mong đợi | Anh chỉ thấy rối bời | Có người quen lại với một mình | Cô độc giữa thành phố lung linh | Có người xem lại những khung hình | Ngỡ mình trong hạnh phúc trắng tinh | Có người đã quên anh xấu thế nào | Khi bình yên ngủ lúc bên nhau | Có người đã quên hết kỉ niệm | Để lại một người với tiếng mưa đêm | Không một ai thêm nữa | Sẽ không thể yêu thêm nữa | Khi tất cả tan vào vầng trăng sáng | Hạnh phúc giờ biến thành những ngổn ngang | Có người nói anh xấu thế nào | Khi nhìn anh ăn lúc chưa no | Có người nói anh khó thế nào | Khi nhìn gương mặt anh đắn đo | Có người nói anh ấm thế nào | Khi ùa đến cuộn trong cánh tay anh | Có người đã quên hết kỉ niệm | Để lại một người với tiếng mưa đêm,
xPKU5WkLOqA,"CON HỨA SẼ VỀ - LÊ BẢO BÌNH | OFFICIAL MUSIC VIDEO | NHẠC XUÂN 2023 - MẸ, XUÂN NÀY CON VẪN THA HƯƠNG",Lê Bảo Bình,303,24011302,"nhac xuan 2023, nhạc xuân 2023, lê bảo bình, le bao binh, nhac tet 2023, nhạc tết 2023, tet nay con se ve, tết này con sẽ về, xuân này con về, con hua se ve, con hứa sẽ về, con hua se ve remix, con hua se ve lofi, con hua se ve karaoke, con hứa sẽ về karaoke, me xuan nay con van tha huong, mẹ xuân này con vẫn tha hương, xuân xa xứ, lk nhac xuan, lk nhac xuan 2023, le bao binh nhac xuan, me xuan nay con van tha huong tiktok, con hua se ve lyrics, con hua se ve beat","Mẹ xuân này, con vẫn tha hương. | Rời xa người thương, đến nơi phố phường. | Đời phiêu bạt, dãi nắng dầm sương. | Phận làm con, bao mùa vắng mặt | Vì mưu sinh con chưa về được | Ở nơi xứ người, mẹ ơi có hay | Người ta chúc nhau, đón tết sum vầy. | Còn con thì, lệ ướt mi cay. | Nhà ta nghèo, nên đành phải thế | Biết bao giờ mới được về đây. | Ngày xưa ! | Thuở mới nằm nôi, đến khi vào đời. | Mẹ ru những tiếng ru hời. | Bố ngồi kể chuyện sao rơi | Ngày vào xuân, pháo nổ rợp trời. | Mẹ xứ người, bọn con mến nhau | Vài câu chuyện nặng trĩu cơn đau | Thằng không cha, đứa vừa mất mẹ | Ôi sao lòng nguội lạnh tái tê | Mẹ xuân sau! Con hứa con về. | Ở nơi xứ người, mẹ ơi có hay | Người ta chúc nhau, đón tết sum vầy. | Còn con thì, lệ ướt mi cay. | Nhà ta nghèo, nên đành phải thế | Biết bao giờ mới được về đây. | Ngày xưa ! | Thuở mới nằm nôi, đến khi vào đời. | Mẹ ru những tiếng ru hời. | Bố ngồi kể chuyện sao rơi | Ngày vào xuân, pháo nổ rợp trời. | Mẹ xứ người, bọn con mến nhau | Vài câu chuyện nặng trĩu cơn đau | Thằng không cha, đứa vừa mất mẹ | Ôi sao lòng nguội lạnh tái tê | Mẹ xuân sau! Con hứa con về. | Thằng không cha, đứa vừa mất mẹ | Ôi sao lòng nguội lạnh tái tê | Mẹ xuân sau! | Con hứa con về.",
AdfSLq7XNoI,MIN - TÌM (LOST) (ft. MR.A) M/V,ST.319 Entertainment,273,23946643,"st.319, st319, st.319 dance, st319 dance, dance cover, kpop dance cover, 9x, kpop dance cover group, st.319 dance from vietnam, st319 dance from vietnam, vietnam, viet nam, việt nam, Việt Nam, min, tìm, tim, lost, vpop, hot, 2013, christmas, xmas, m1, K-pop (Musical Genre), mv, official, full",Không có lời bài hát (Sub),
2DuthnSIeYY,BÍCH PHƯƠNG - Nói Thương Nhau Thì Đừng Làm Trái Tim Em Đau [Official M/V],BÍCH PHƯƠNG,295,23868299,"bích phương, bich phuong, nói thương nhau thì đừng làm trái tim em đau, noi thuong nhau thi dung lam trai tim em dau, mv bích phương, NTNTDLTTED, 1989sPRODUCTION, bich phuong officical, bích phương 2017, BÍCH PHƯƠNG Nói Thương Nhau Thì Đừng Làm Trái Tim Em Đau, bich phuong noi thuong nhau thi dung lam trai tim em dau, nói thương nhau, nói thương nhau bích phương, noi thuong nhau bich phuong, DươngK, Phạm Thanh Hà, Thác Bản Giốc, Cao Bằng, noi thuong nhau, bích phương official mv",Hát lời rằng em đang thầm nhớ | Giữa trời gửi cùng theo làn gió đến anh | Chỉ cần nghĩ về nhau | Về những tháng ngày sau | Là em vui ở trong lòng rất lâu | Chỉ cần biết ngày mai | Mình chung vai kề vai | Ta hãy cứ yêu mãi và thương mãi | Có thương nhau thì mới hiểu cho nhau mà | Đến bên anh em mong được chở che anh à | Và tình yêu trên đầu môi | Sợ là cuộc tình ko thành đôi đâu anh | Nói thương nhau thì đừng làm trái tim em đau | Nói thương nhau thì... | ... thì đừng làm trái tim em đau | Nói thương nhau thì... | ... thì đừng làm trái tim em đau | Chỉ cần nghĩ về nhau | Về những tháng ngày sau | Là em vui ở trong lòng rất lâu | Chỉ cần biết ngày mai | Mình chung vai kề vai | Ta hãy cứ yêu mãi và thương mãi | Có thương nhau thì mới hiểu cho nhau mà | Đến bên anh em mong được chở che anh à | Và tình yêu trên đầu môi | Sợ là cuộc tình ko thành đôi đâu anh | Nói thương nhau thì đừng làm trái tim em đau | Nói thương nhau thì... | ... thì đừng làm trái tim em đau | Nói thương nhau thì... | ... thì đừng làm trái tim em đau | Nói thương nhau thì đừng làm trái tim em đau,
x5CNJUMJcII,Chi Pu | TỪ HÔM NAY (Feel Like Ooh) - Official Music Video (치푸),Chi Pu Official,218,23830412,"Chi pu, từ hôm nay, tu hom nay, hôm nay, hom nay, từ hôm nay chi pu, tu hom nay chi pu, từ hôm nay feel like ooh, feel like ooh, feel like ooh chi pu, chi pu feel like oh, chi pu tu hom nay, mv từ hôm nay chi pu, từ hôm nay mv, chi pu mv, từ hôm nay single, Krazy Park producer, Eddy S Park producer, kpop producer, Chi Pu Dream Show, chi pu tv, 치푸, chi pu ra mắt mv mới, pupufamily, chi pu 2017, từ hôm nay official mv, ooh, feel like, từ nay, pupu",ĐĂNG KÝ KÊNH CHI PU ĐỂ XEM MV MỚI,
N4ziA8NIQEs,Lãng - Đủ trải sẽ thấm ft. Chiennhatlang (Tune #4),Lãng,274,23826257,"mike, chiennhatlang, tune tẩm đá số 04, tune tam da so 04, đủ trải sẽ thấm, du trai se tham, gọi cuộc đời là những vị đắng, tune tẩm đá 4, tune tam da 4, tune tẩm đá số 4, tune số 4, tune số 04, tune tẩm đá 04, mike official, tune tẩm đá beat, tune tẩm đá mike, tune tẩm đá chiennhatlang, chiến nhất lang, mike rap, mike rapper, rapper mike, tune tẩm đá, tune tam da, rap, rap việt, nhạc tẩm đá, nhac tam da, đóng tune, tune thủ, auto tune, mike x chiennhatlang, mikelodic",Không có lời bài hát (Sub),
caoxaO_nKFU,VỀ VỚI EM - VÕ HẠ TRÂM | OFFICIAL MUSIC VIDEO | THE LOVE JOURNEY,Võ Hạ Trâm Official,301,23809050,"võ hạ trâm, vo ha tram, ca sĩ võ hạ trâm, ca si vo ha tram, vo ha tram official, ca sĩ hạ trâm, tuyển tập võ hạ trâm, album võ hạ trâm, VO HA TRAM, VO HA TRAM OFFICIAL, võ hạ trâm live, võ hạ trâm hát live, ca khúc võ hạ trâm hay nhất, những ca khúc hay nhất của võ hạ trâm, VỀ VỚI EM - VÕ HẠ TRÂM, về với em official music video, THE LOVE JOURNEY VÕ HẠ TRÂM, THE LOVE JOURNEY, dâu ấn, cô dâu ấn độ, dâu ấn võ hạ trâm, về với em the love journey, VVE, VHT, TLJ, SMEVN",Nắm tay của anh em nguyện đi đến nơi chân trời | Những con đường quen thời thơ ấu anh dạo chơi | Có câu chuyện xưa kể lại | Mãi không nhạt phai | Kho báu nào giấu trong sa mạc cằn khô | Nắng tô bờ môi | tô nụ hôn phía bên kia đồi | Hát lên cùng em | ngày hai chúng ta thành đôi | Dắt em cùng quay về nhà | Dẫu muôn dặm xa | Kho báu là trái tim đôi ta gần nhau | Về là về với em đi nào | Về là về với nhau | Về là về với em đi nào | Bên sông ngắm nhìn thinh không | Về là về với em đi nào | Về là về với nhau | Về là về với em đi nào | Bên sông ngắm nhìn thinh không | Tera hath Tham ke dunia ke aanth tak jaungi | Bachpan ke un jane rasto pơ jahan tuum khele | Woo purani kahani jo ab tak bhuli nahin. | Jo khajana is thaar mein chupa | Suraj ki lali ma hoto pe | Shadi ke din gao mere xâng | Muje ghar le chalo | Anmohe hai hamara dil jo saath mein rehta hê | Mere pass aao | Us suraj ki kirno ko niharte | Mere pass aao | Us suraj ki kirno ko niharte | Về là về với em đi nào | Về là về với nhau | Về là về với em đi nào | Bên sông ngắm nhìn thinh không | Về là về với em đi nào | Về là về với nhau | Về là về với em đi nào | Bên sông ngắm nhìn thinh không,
T7ksmtaVeOk,Low G | In Love (ft. JustaTee) | ‘L2K’ The Album,Low G,201,23761083,"Low G, low g, lowg, LowG Official, In Love Low G, In Love JustaTee, In Love ft JustaTee, low g in love, in love lowg, low g justa tee, justatee low g, L2K Low G, L2K album, album L2K low g, low g l2k, lowg l2k, low g album l2k, in love l2k, low g rap, rap viet low g, rap chill low g, low g nhac rap, low g official audio, low g in love l2k",Không có lời bài hát (Sub),
AczgBdaeY38,Nghe là mê với ca khúc Giận Mà Thương - Lê Thu Uyên (Official MV),Giọng Ca Để Đời,356,23756558,"gian ma thuong le thu uyen, giận mà thương lê thu uyên, gian ma thuong, giận mà thương, le thu uyen, lê thu uyên, nghe là mê, nhac tru tinh que huong, nhac tru tinh, trữ tình quê hương, le thu uyen giong ca de doi, giọng ca để đời","Em xa anh nghe câu dân ca | Giận mà thương sao mà da diết thế | Ôi câu ca nặng tình, nặng nghĩa | Có lúc nào anh giận em không | Rứa có lúc nào em giận anh không | Để thương suốt cả ngày em giận | Khi xa nhau đến ngàn vạn dặm | Giận chẳng còn mà thương rộng dài thêm | Em nhớ ngày, em nhớ đêm | Giận mà sao mà thương cháy lòng em đó | Thương mà giận dễ gì đã có | Em chỉ nhìn thấy ở anh thôi | Một nắng hai sương đội trời đạp đất | Bao vất vả bàn tay em lo hết | Bao đổi thay anh chưa thể hiểu | Ơi câu ca rằng giận mà thương, mà thương | Anh lại đi khắp mọi nẻo đường | Mang câu ca và tình yêu thắm đượm | Khi trở gió, mình vẫn ấm | Với giận rồi cũng chỉ để thương thêm. | Em xa anh nghe câu dân ca | Giận mà thương sao mà da diết thế | Ôi câu ca nặng tình, nặng nghĩa | Có lúc nào anh giận em không | Rứa có lúc nào em giận anh không | Để thương suốt cả ngày em giận | Khi xa nhau đến ngàn vạn dặm | Giận chẳng còn mà thương rộng dài thêm | Em nhớ ngày, em nhớ đêm | Giận mà thương cháy lòng em đó | Thương mà giận dễ gì đã có | Em chỉ tìm thấy ở anh thôi | Một nắng hai sương đội trời đạp đất | Bao vất vả bàn tay em lo hết | Bao đổi thay anh chưa thể hiểu | Ôi câu ca rằng giận mà thương, mà thương | Anh lại đi khắp mọi nẻo đường | Mang câu ca và tình yêu thắm nồng | Khi trở gió, anh vẫn ấm | Với giận rồi cũng chỉ để thương thêm.",
wbLGXmRtlYw,Mặt Trái Sự Thật | Nhóm HKT | Official Music Video,POPS MUSIC,280,23729003,"mat trai su that, mặt trái sự thật, nhom hkt, nhóm hkt, mv mat trai su that, mv mặt trái sự thật, mv mat trai su that hkt, mv mặt trái sự thật hkt, chỉ là hình thức em quan tâm tôi như người yêu, hkt karaoke, sự thật sau một lời hứa, karaoke hkt, mặt trái của sự thật karaoke, người ta nói em yêu tôi, them mot lan dau, tội nghiệp cho tôi bơ vơ trong màn đêm, nguoi ta noi em yeu toi nguoi ta noi em thuong toi",Hùng : Nhân tiện bữa tối ngày hôm nay | Hùng xin giới thiệu bạn gái của Hùng Bảo Loan | Kiệt : Mày thay bồ như thay áo ớ !! | Nhìn anh Ti nè | Đến giờ vẫn chưa có một nửa kia của mình | Ti : *cười* | Bảo Loan : Anh chết với em nha !! *liếc* | Hùng : Mày yên tâm đi !! | Tao đang định giới thiệu em gái của Bảo Loan | Cho anh Ti | Mà hỏng biết ảnh có chịu không | Bảo Loan : Vậy là ăn xong em có người đưa về tới nhà rồi nha  rồi nha | Hùng : Thôi đừng để mất thời gian nữa ! | Xin mời mọi người dùng buổi tối | *Lyrics* : Người ta nói  em yêu tôi . Người ta nói em thương tôi | Bên tôi vui buồn sớt chia | Người ta thấy em bên tôi và người ta ước mong như tôi | Xem tôi là người hạnh phúc | Mà người ta đâu có hay lòng tôi như đang vỡ tan | Vẫn vui tươi bên người yêu | Mặc cho em luôn thản nhiên và mặt cho em đang đóng phim | Một cuốn phim cho bao người xem | Chỉ là hình thức em quan tâm tôi như người yêu | Trước mắt thế gian đâu ai hay biết một sự thật | Rằng em không yêu tôi rằng em không thương tôi | Em chỉ xem tôi như một tấm bia chắn | Tội  nghiệp cho tôi bơ vơ cô đơn trong màn đêm | Khi đã biết em xay mê trong tim một bóng hình | Người mà em yêu thương người cho em bao giấc mơ | Những giấc mơ của hai người đàn bà | Mà người ta đâu có hay lòng tôi như đang vỡ tan | Vẫn vui tươi bên người yêu | Mặc cho em luôn thản nhiên và mặt cho em đang đóng phim | Một cuốn phim cho bao người xem | Chỉ là hình thức em quan tâm tôi như người yêu | Trước mắt thế gian đâu ai hay biết một sự thật | Rằng em không yêu tôi rằng em không thương tôi | Em chỉ xem tôi như một tấm bia chắn | Tội nghiệp cho tôi bơ vơ cô đơn trong màn đêm | Khi đã biết em say mê trong tim một bóng hình | Người mà em luôn yêu thương người cho em bao giấc mơ | Những giấc mơ của hai người đàn bà ba.... | #SyVy | #Mặt_Trái_Sự_Thật_HKT,
sU8G7Q4rUA4,BÍCH PHƯƠNG - Nâng Chén Tiêu Sầu (Official M/V),BÍCH PHƯƠNG,250,23673835,"bích phương, bich phuong, nhạc bích phương, nâng chén tiêu sầu, nang chen tieu sau, nâng chén tiêu sầu bích phương, bich phuong nang chen tieu sau, nang chen tieu sau bich phuong, mv nang chen tieu sau, nang chen tieu sau mv, nang chen tieu sau lyric, mv moi, official music video, nhac viet moi nhat, nang chen tieu sau remix, nang chen tieu sau dance, bích phương mv, mv bich phuong moi nhat, nhạc 8/3, nâng chén, tiêu sầu, tuyen tap 8/3, remix nang chen tieu sau","♪ Anh thấy đôi mắt em sầu, chẳng phải vì người đến sau ♪ | ♪ Cũng chẳng phải bởi anh đâu, bởi anh đâu đáng để phải đau ♪ | ♪ Em muốn đêm tối không màu, nhớ thương không cuối không đầu ♪ | ♪ Em uống thêm chút men sâu, xem con tim em còn nông sâu ♪ | ♪ Một chén cho người, mười năm bỗng hoá hư không ♪ | ♪ Không luyến lưu gì, người đi không nhớ không mong ♪ | ♪ Một chén cho đời, lả lơi con nước xuôi dòng ♪ | ♪ Có chăng cũng là, trôi về biển rộng mênh mông ♪ | ♪ Há á á áà, một lần thôi em say nghiêng ngả ♪ | ♪ Uống hết những xót xa em còn mang ♪ | ♪ Há á á áà, giọt sầu rơi, buông lơi em thả ♪ | ♪ Chấm hết những tháng năm lòng ngổn ngang ♪ | ♪ Em muốn nâng chén tiêu sầu ♪ | ♪ Quen sống trong đống u sầu, để rồi chẳng còn biết đau ♪ | ♪ Nên đến khi phải xa nhau, trái tim em không thể nhỏ máu ♪ | ♪ Xin lỗi khi phải xa nhau, bởi em tim đã phai màu ♪ | ♪ Em cũng không trách anh đâu, nên mong anh trong lòng không đau ♪ | ♪ Một chén cho người, mười năm bỗng hoá hư không ♪ | ♪ Không luyến lưu gì, người đi không nhớ không mong ♪ | ♪ Một chén cho đời, lả lơi con nước xuôi dòng ♪ | ♪ Có chăng cũng là, trôi về biển rộng mênh mông ♪ | ♪ Há á á áà, một lần thôi em say nghiêng ngả ♪ | ♪ Uống hết những xót xa em còn mang ♪ | ♪ Há á á áà, giọt sầu rơi, buông lơi em thả ♪ | ♪ Chấm hết những tháng năm lòng ngổn ngang ♪ | ♪ Em muốn nâng chén tiêu sầu ♪",
