Video_ID,Raw_Title,Clean_Title,Uploader,Lyric
UfMEtjxzpBk,SEE TÌNH,SEE TÌNH,Hoàng Thùy Linh,"11 Contributors
See Tình Lyrics
Uầy, uầy, uây, uây
Sao mới gặp lần đầu mà đầu mình quay quay
Anh ơi anh à
Anh bỏ bùa gì mà lại làm em yêu vậy?
Bae, bae, bae, bae
Em nói từ đầu, baby, can you stay?
Mai đi coi ngày
Xem cưới ngày nào thì nhà mình đông con vậy?
Nếu như một câu nói có thể khiến anh vui (Ih ạ, ih ạ)
Sẽ suốt ngày luôn nói không ngừng để anh cười (Na-na-na)
Nếu em làm như thế trông em có hâm không? (Đi-đi-điên lắm!)
Đem ngay vô nhà thương, đem ngay vô nhà thương
Đem ngay vô nhà anh để thương!
Giây phút em gặp anh là
Em biết em see tình
Tình, tình, tình, tang, tang tính
Tang tình, tình, tình tang, tang, tang
Giây phút em gặp anh là
Em biết em see tình
Tình đừng tình, toan, toan, tính
Toang tình, mình tình tan, tan, tan, tình

Yeah, yeah
Anh tính sao, giờ đây anh tính sao?
Yeah, yeah
Anh tính sao, giờ đây anh tính sao?
Tới đâu thì tới
Tới đâu thì tới
Em cũng chẳng biết tới đâu (Tới đâu)
Biết yêu là khó
Không yêu cũng khó
Em cũng chẳng biết thế nào (Biết thế nào)
Hôm nay tia cực tím xuyên qua trời đêm
Anh như tia cực hiếm xuyên ngay vào tim (Huh-ah, ooh)
Ấy, ấy, ấy, chết em rồi
Ấy, ấy, chết thật thôi
Nếu như một câu nói có thể khiến anh vui (Ih ạ, ih ạ)
Nói thêm một câu nữa có khi khiến anh buồn (Na-na-na)
Nếu em làm như thế trông em có hâm không? (Đi-đi-điên lắm!)
Đem ngay vô nhà thương, đem ngay vô nhà thương
Đem ngay vô nhà anh để thương!
Giây phút em gặp anh là
Em biết em see tình
Tình, tình, tình, tang, tang tính
Tang tình, tình, tình tang, tang, tang
Giây phút em gặp anh là
Em biết em see tình
Tình đừng tình, toan, toan, tính
Toang tình, mình tình tan, tan, tan, tình

Yeah, yeah
Anh tính sao, giờ đây anh tính sao?
Yeah, yeah
Anh tính sao, giờ đây anh tính sao?
Giây phút em gặp anh là
Em biết em see tình"
jFm6foslw9o,"Muối ơi - Sáng tác: Phạm Hồng Biển, Ca sỹ -Tố My ( OST phim Hai Muối)",,Tố My,"1 người đóng góp
Lời bài hát Nhạc phim cho cuộc đời tôi 2013
Đối với tôi, năm 2013 được đánh dấu bằng sự quan tâm sâu sắc hơn đến hip hop, indie folk và nhạc điện tử. Tôi mới bắt đầu tìm hiểu về hip hop và đang mong muốn mở rộng thư viện của mình cho các nghệ sĩ mới.
TUYÊN BỐ TỪ CHỐI TRÁCH NHIỆM: NHỮNG BÀI HÁT NÀY KHÔNG CẦN PHÁT HÀNH TRONG NĂM NÀY, CHỈ CHỈ LÀ BÀI HÁT TÔI NGHE NHIỀU VÀ THÍCH.
$WAG
Những bài hát này khiến tôi cảm thấy như thế giới là con chó cái của mình. Và hầu hết trong số này là những vụ nổ thương mại. Thú vui tội lỗi của tôi.
All Me – Drake ft. 2 Chainz và Sean lớn
Tôi làm điều đó – 2 Chainz feat. Drake và Lil Wayne
Versace – Migos feat. Drake
Ca khúc cay đắng – Kendrick Lamar feat. Học sinh Q
Bắt đầu từ dưới đáy – Drake
Hành vi tồi tệ nhất – Drake
1Train – Asap Rocky ft. Mỗi MC tài năng
Vấn đề chết tiệt – Asap Rocky ft 2 Chainz và Kendrick Lamar
Thành tích của Phong trào Illest – Viễn Đông. Riff Raff
Riff Raff, 2 Chainz màu trắng
Jig đã thành công – Kendrick Lamar và J. Cole
Nóng lòng chờ đợi album hợp tác này.
Quái vật tự do – Kendrick Lamar
Kiểm soát x100
5 giờ sáng ở Toronto – Drake
POP
Cabaret – Justin Timberlake ft. Drake
Tôi không thực sự cảm nhận được Trải nghiệm 20/20, nhưng bài hát này mang đến định nghĩa về sự thú vị.

Sự Tự Tin – Justin Bieber ft. Cơ Hội Rapper
Bieber cuối cùng đã đánh rơi quả bóng của mình. Một giọng hát sát thủ với nhịp điệu lập dị bổ sung cho câu Chance, bài hát này đã chiến thắng.
Tất cả những điều đó đều quan trọng – Justin Bieber
Khiến tôi cảm thấy như mình có thể tán tỉnh bất kỳ cô gái nào.
Yêu nhiều hơn – Chris Brown ft. Nicki Minaj
ĐIỆN TỬ
Sleepyhead – Hố Đam Mê
Slasherr – Rustie
Cao hơn – Just Blaze và Bauer
Vùng đất cao hơn – TNGHT
TÌNH YÊU/MỊN MÀNG
Rõ ràng Drake sẽ sở hữu phần này
IFHY – Tyler Người sáng tạo
Chưa bao giờ thích Odd Future, nhưng Tyler thực sự trưởng thành hơn trong album mới của mình, và bài hát này dễ dàng trở thành một trong những bài hát hay nhất.
Đi Qua – Drake
The Motion – Drake ft. Sampha
Những cô gái yêu Beyonce – Drake
Mũi Đỏ – Hiền Nhân Song Tử
ALBUM TÔI YÊU THÍCH
Nỗi buồn bất lực – Hạm đội cáo
Hạm đội cáo – Hạm đội cáo
Đây là năm cuối cùng tôi đánh giá cao Fleet Foxes. Hòa âm và nhạc cụ tuyệt đẹp. Nếu có một tính từ để miêu tả âm nhạc của Fleet Foxes thì đó sẽ là tuyệt vời. Các ca khúc nổi bật là The Cascades on Helpless Blues và Tiger Mountain Peasant Song trên Fleet Foxes.

Đứa trẻ ngoan thành phố Maad – Kendrick Lamar
Không nói được.
Trân trọng – Ariana Grande
Với một trong những giọng hát tuyệt vời và nội lực nhất trong thời đại mà không ai có thể hát trực tiếp cộng với khuôn mặt/tính cách xinh đẹp, tôi hoàn toàn yêu cô gái này. Tôi rất thích mọi bài hát trong album này. Nghe một cảm giác hoài cổ và cảm thấy tốt.
Dành cho Emma, mãi mãi về trước – Bon Iver
Đối với những trái tim lạnh giá nhất.
HÃY THAM GIA NEEDLEDROP ĐỂ GIỚI THIỆU CHO TÔI ÂM NHẠC MỚI."
BdUpEgc1Wp0,Đen - Mưa Trên Những Mái Tôn ft. Kaang (Prod. By Maxbenderz) (Official Audio w/lyrics),Mưa Trên Những Mái Tôn,Đen Vâu Official,"4 Contributors
Mưa Trên Những Mái Tôn Lyrics
""Lộp độp, lộp độp""
Falling in love theo cách bộp chộp
Ngồi kề bên nhau chưa kịp ấm hơi
Hương tàn ngày cũ chưa đầy một hộp
Đêm nay mi mắt treo biển: Cấm rơi
Thả một làn khói vào trong hư không
Tiết trời không lạnh mà lòng như đông
Giấy bút và mực như là thư đồng
Em ơi cảm xúc có còn dư không?
Ngày nào đó cho ta vay mượn
Chết trong niềm say đượm
Sống những ngày bâng quơ
Rơi khi còn bay lượn
Nhắm mắt, chẳng biết trước điều gì chờ
Nỗi buồn đi lạc lấy đi rất nhiều thì giờ
Cứ như là mưa trên những mái tôn
Anh đã vỡ vụn trước khi kịp đưa em những cái hôn
Rơi cùng anh một lần
Tan cùng anh một lần
Như là mưa trên mái tôn
Như là mưa trên mái tôn
Mưa trên mái tôn, mưa trên mái tôn
Mưa trên mái… mưa trên mái…
Mưa trên mái tôn

Muốn lại ngồi với em một sớm đầu đông
Mây về xám xịt rực môi em màu hồng
Cái lạnh miền Bắc cho lồng ngực này máu nóng
""Em ơi có muốn gọi 1 cốc mầu không ?""
Mưa trên mái tôn êm đềm ngỡ hát
Vang vọng một lần trước khi chìm vào vỡ nát
Trước khi ta kịp đem dây rợ mà buộc mình
Quá đủ cho một cuộc tình
""Chẳng trò chơi nào thắng mãi
Chẳng có đêm nào trắng hoài
Chẳng niềm đau nào đắng mãi
Chuyện tình vẫn đẹp dù chẳng kể ngắn dài""
Hãy như là mưa trên mái tôn đi em
Rơi cùng anh vỡ trên mái tôn đi em
Một lần ngấm lạnh để biết cảm giác rùng mình
Còn quá trẻ để em chọn sự hi sinh
Rơi cùng anh một lần
Tan cùng anh một lần
Như là mưa trên mái tôn
Như là mưa trên mái tôn
Mưa trên mái tôn, mưa trên mái tôn
Mưa trên mái… mưa trên mái…
Mưa trên mái tôn"
He8FVJuCjpI,"MANBO, HIEUTHUHAI, HURRYKNG | Phải Là Yêu | Official Video",Phải Là Yêu,GERDNANG,"2 Contributors
Phải Là Yêu Lyrics
Tình yêu đi vào đâu đây? (Đâu đây?) Làm ta yêu hoài, đâu hay? (Đâu hay?)
Có yêu nhưng mà không hề nói ra
Anh mong thấy em trong một gói quà bất ngờ
Nếu không phải là mơ, em nói em phải làm ngơ
Hóa ra em cần cơ, anh biết anh thật thờ ơ (Brrrr)
Em là một nghệ thuật mà bàn tay anh điêu khắc
Anh là một nghệ nhân sẽ không buồn hiu hắt (Whoo!)
Trong người anh rạo rực, anh sẽ đeo em như bông (Tai)
Yêu theo kiểu bạo lực, xô ngã em vào trong lòng (Shy)
Bàn tay anh là AirPod, áp bên tai ở chế độ chống ồn
Phải thế nào mà đôi ta mới yêu nhau?
Nhưng mà lời anh nói thì không có điêu đâu
Nên là trong tình yêu thì phải làm tất cả
Anh đi theo em vì xăng không có sợ mất giá
HURRYKNG
]
Và điều đó là yêu, yeah (Yêu, yeah, yêu, yeah)
Và cảm xúc đó phải là yêu, yeah (Yêu, yeah, yêu, yeah)
Vì anh biết em chỉ làm kiêu, yeah (Kiêu, yeah, kiêu, yeah)
If you got nothing to say, then it must be love (
)
Đó có phải là yêu? Yeah (Yêu, yeah, yêu, yeah)
Em hãy nói lớn lên: 'Em yêu anh' (Yêu anh, yêu anh)
Vì anh biết em chỉ làm kiêu, yeah, uh (Kiêu, yeah, kiêu, yeah)
If you got nothing to say, then it must be love (Whoo!)

HURRYKNG
]
Anh đang có đắng cay, cùng con tim đắm say
Cộng với tình yêu em là anh thấy trắng tay (
Hiếu!
)
Mơ lên xe chạy trên highway và chỉ có hai ta
Như thiên thần rơi xuống trần gian, gọi em là Maika
Xúc cảm này là sao, hả? (
Whoo!
)
Một cái chạm làm anh đỏ mặt y như là Sao Hỏa (
You know?
)
Em là Corona, làm anh say
Anh thì anh không ngại được cách ly ở trong vòng tay
Em là Corona, làm anh khó thở rồi lăn quay
 (
Brrrrrtt!
)
It's like 1, 2, 3 to thе 4
Đếm từng thứ, ngày, tháng, chờ ta về bên nhau
Áp tai vào cho sát, nghe lồng ngực anh ""bụp bụp""
Trả lời anh câu hỏi, rung động này là từ đâu?
Phấn khích nhận tin nhắn (Nhắn) rồi nghĩ về tương lai (Lai)
Đầu óc thì không im ắng mà chỉ nhớ về mùi hương ai
Vì con tim không biết nói dối, chỉ có em tự dối lòng
Và nếu đây không là tình yêu, hãy chứng minh là anh sai, baby
HURRYKNG
]
Và điều đó là yêu, yeah (Yêu, yеah, yêu, yeah)
Và cảm xúc đó phải là yêu, yeah (Yêu, yeah, yêu, yeah)
Vì anh biết em chỉ làm kiêu, yeah (Kiêu, yeah, kiêu, yeah)
If you got nothing to say, then it must be love (
)
Đó có phải là yêu? Yeah (Yêu, yeah, yêu, yeah)
Em hãy nói lớn lên: 'Em yêu anh' (Yêu anh, yêu anh)
Vì anh biết em chỉ làm kiêu, yeah, uh (Kiêu, yeah, kiêu, yeah)
If you got nothing to say, then it must be love (
Whoo!
)

Hai đứa trên chiếc xe màu vàng, uh, mời em ngồi yên sau
Bật mui, đem đầu óc của em lên mây (Ah! Ah!)
Nếu em không bầu bạn, uh, thì sao mình bên nhau?
Cạnh em thì anh không khác gì người trên dây ('S right, right)
Anh có hai chiếc áo, một để giữ ấm em
Hai là thấm nước mắt sau một cơn say, em đã ngấm men (Oh my God!)
Ta cùng một linh hồn, be same
Hai thân xác này nguyên đêm
Anh cân nhắc, nếu mình bắt được cùng tần số thì anh chắc mình twin flame
You know (Hey!), nếu không là em thì là ai? (Who?)
Chờ một dòng tin nhắn từ nay đến ngày mai
(Hey!) All in, chơi cho lớn là vì ai?
Em có thêm một bờ môi và sau đó là hai bờ vai (Hah! Hah!)
And I really want you in my life
Nhắn cho anh ngay đi, đang mong chờ
Chắc em đâu ngờ, không thể sai!
(Một, hai, ba) Đây là tình yêu chứ đâu còn gì nữa để bàn cãi, huh?
HURRYKNG
, 
HIEUTHUHAI & HURRYKNG
]
Và điều đó là yêu, yeah (Yêu, yeah, yêu, yeah) (
Hey, yeah!
)
Và cảm xúc đó phải là yêu, yeah (Yêu, yeah, yêu, yeah) (
Hey, yeah!
)
Vì anh biết em chỉ làm kiêu, yeah (Kiêu, yeah, kiêu, yeah) (
Hey, yeah!
)
If you got nothing to say, then it must be love (
)
Đó có phải là yêu? Yeah (Yêu, yeah, yêu, yeah) (
Hey, yeah!
)
Em hãy nói lớn lên: 'Em yêu anh' (Yêu anh, yêu anh) (
Hey, what?
)
Vì anh biết em chỉ làm kiêu, yeah, uh (Kiêu, yeah, kiêu, yeah) (
Yeah!
)
If you got nothing to say, then it must 
be love!

I'll never be alone again
I'll never be alone again
Never be alone again, I'll never be alone
I'll never be alone again
I'll never be alone again
Never be alone again, I'll never be alone"
GtP3wH3ujvU,Khói thuốc đợi chờ | Media Acoustic,Khói thuốc đợi chờ,Media Acoustic,"1 Contributor
Khói Thuốc Đợi Chờ Lyrics
Yêu nhau cho đớn đau
Hằn sâu trong thịt da
Có những vết thương
Còn để lại đời ta
Giày vò theo tháng ngày
Ôm ấp cuộc tình
Cuộc tình buồn vì ngày đó người đi
Yêu hay gieo khổ đau
Giờ ta xa rời nhau
Có những lúc
Anh ngồi một mình đợi em
Đợi người đi chẳng về
Quên mất câu thề
Bỏ lại đây tình ta còn đang dở dang
Giữa bóng tối
Anh ngồi đây buồn khói thuốc
Giữa những nỗi đau
Còn đang kêu than trong hồn anh
Cho đời xót xa
Vì nụ hôn còn thiết tha
Khói thuốc trắng
Ly cà phê càng thêm đắng
Thấm ngón tay vàng
Tim chơi vơi
Theo thời gian gõ nhịp vắng em
Giờ thầm chết trong anh
Ôi bao năm tháng yêu
Giờ ta xa rời nhau
Có những lúc
Anh ngồi một mình đợi em
Chờ người đi chẳng về
Quên mất câu thề
Còn lại đây tình ta còn đang dở dang
Giữa bóng tối
Anh ngồi đây buồn khói thuốc
Giữa những nỗi đau
Còn đang kêu than trong hồn anh
Cho đời xót xa
Vì nụ hôn còn thiết tha
Khói thuốc trắng
Ly cà phê càng thêm đắng
Thấm ngón tay vàng
Tim chơi vơi
Theo thời gian gõ nhịp vắng em
Giờ thầm chết trong anh
Có những chiều anh nhớ em
Nhớ em thật nhiều
Mong rằng ta còn tìm đến nhau
Khói thuốc tàn trong quán khuya
Anh vẫn đợi chờ
Tìm đâu ngày xưa
Giờ đây, giờ đã cách xa
Giữa bóng tối
Anh ngồi đây buồn khói thuốc
Giữa những nỗi đau
Còn đang kêu than trong hồn anh
Cho đời xót xa
Vì nụ hôn còn thiết tha
Khói thuốc trắng
Ly cà phê càng thêm đắng
Thấm ngón tay vàng
Tim chơi vơi
Theo thời gian gõ nhịp vắng em
Giờ thầm chết trong anh
Tim chơi vơi
Theo thời gian gõ nhịp vắng anh
Giờ thầm chết trong anh"
BzzP4X30r48,GẶP NHAU - CẨM LY & QUỐC ĐẠI | Sáng tác: Minh Vy,GẶP NHAU,CẨM LY OFFICIAL,"1 Contributor
Rồi Mình Sẽ Gặp Nhau Lyrics
Nếu lỡ mai ta rời xa xin đừng ưu sầu lâu quá
Nếu lỡ mai ta rời xa chỉ là khoảng cách thôi mà
Sẽ chỉ là những giờ phút, cảm thấy cô đơn một chút
Chỉ cần ta nhớ về nhau thế thôi
Trái Đất bao la rộng lớn, chỉ người ta là không lớn
Vẫn mãi như đứa trẻ con, vẫn thèm hơi ấm vuông tròn
Có cách xa nhau là nhớ, mới biết xa nhau là ngỡ
Đời tựa cơn mơ, vụt tan bất ngờ...
Rồi mình sẽ gặp nhau
Lúc nước mắt tan đi trong tiếng cười
Rồi mình sẽ gặp nhau
Lúc ánh nắng thay cơn mưa cất lời
Rồi mình sẽ gặp nhau vì
Cuộc đời có dài đâu mà
Thời gian bao lâu vẫn không úa màu
Rồi mình sẽ gặp nhau
Lúc ánh sáng xua đi đêm tối không màu
Rồi mình sẽ gặp nhau
Lúc ký ức thay bông hoa trắng trên đầu
Rồi mình sẽ gặp nhau vì
Cuộc đời có dài đâu mà
Thật lòng tôi mong người sống yên bình
Rồi mình sẽ gặp nhau

Tôi đem hết những ký ức này dệt thành bài ca
Hát ru người thương những đêm còn vương
Một niềm nhớ hoang đường..."
lv0rMAmNfzg,Tôi Vẫn Nhớ - Khưu Huy Vũ ft Dương Hồng Loan [Official],Tôi Vẫn Nhớ,POPS MUSIC,"3 người đóng góp
Bản dịch
tiếng Đức
Tiếng Anh
Lời bài hát La Cucaracha
La Cucaracha, con gián
không thể đi bộ được nữa
Bởi vì anh ấy không có nó, bởi vì anh ấy thiếu nó
Cần sa để hút thuốc"
i6gVxEhVvXQ,"LỜI THẬT LÒNG KHI SAY - Miu Lê, Bích Phương, Quỳnh Anh Shyn, Juky San | Em Xinh Say Hi [Performance]",Lời Thật Lòng Khi Say,Vie Channel - MUSIC,"3 Contributors
LỜI THẬT LÒNG KHI SAY Lyrics
Nếu mất mát có nghĩa là yêu
Có lẽ em đã yêu quá nhiều
Bao lâu nay có lẽ đã yêu quá nhiều
Nếu đến lúc chấm dứt tình yêu
Phải thật lòng kể ra những điều
Từ rất lâu là em mềm yếu
Từng điên cuồng cho đi hết trái tim
Tựa như lần đầu
Tin anh yêu, anh biết, anh hiểu thấu
Tình yêu tựa như phim ấy
Nếu không phải nói chia tay
Mà bây giờ đây chỉ thấy
Tình yêu ngọt ngào giờ đắng ngắt
Đến lúc buông rồi
Những câu ""yêu"" là nói dối
Đành thôi đợi chờ và trông mong
Sẽ thôi đau lòng
Hết đêm này là xong

Bắt đầu cơn say men
Để dứt cơn say tình
Bắt đầu cơn say men
Nói cùng màn đêm đen
Làm chứng cho đôi mình
Bây giờ thành không quen
Với em anh không còn là ngàn ánh dương
Dù biết vẫn hơi đau là còn một chút thương
Tự nhiên em vẫn có thể chữa lành
Điều đầu tiên em cần bỏ đi là anh
Mời anh rời xa nhanh
Từng điên cuồng cho đi hết trái tim
Tựa như lần đầu
Tin anh yêu, anh biết, anh hiểu thấu
Tình yêu tựa như phim ấy
Nếu không phải nói chia tay
Mà bây giờ đây chỉ thấ
Tình yêu ngọt ngào giờ đắng ngắt
Đến lúc buông rồi
Những câu yêu là nói dối
Đành thôi đợi chờ và trông mong
Sẽ thôi đau lòng
Hết đêm nay là xong

All
]
Bắt đầu cơn say men
Để dứt cơn say tình
Bắt đầu cơn say men
Nói cùng màn đêm đen
Làm chứng cho đôi mình
Bây giờ thành không quen
Bắt đầu cơn say men
Để dứt cơn say tình
Bắt đầu cơn say men
Nói cùng màn đêm đen
Làm chứng cho đôi mình
Bây giờ thành không quen"
2bUScL5ojlY,Đen x Chi Pu x Lynk Lee - Nếu Mình Gần Nhau (Audio),Nếu Mình Gần Nhau,Đen Vâu Official,"2 Contributors
Nếu Mình Gần Nhau Lyrics
Có những lúc ta thấy nghi ngờ
Với những thứ dưới mắt ta nhìn
Những lời nói đâu đó bên tai đánh giá nhau
Ai cũng muốn phán xét cuộc đời
Mấy ai muốn ngồi nghe đôi lời
Những hoài nghi làm cho mọi người, cứ cách xa
Cuộc sống như một hộp bút màu
Và mỗi người chúng ta vẽ nên cả thế giới
Hướng đôi mắt về phía mặt trời
Tâm hồn tắm trong ánh xuân ngời
Tết mà không gắn kết, sẽ buồn hết cả năm
Bao hoài nghi và những u sầu
Xóa đi hết đừng để trong đầu
Mỗi ngày trong năm sẽ vui như Tết nếu mình gần nhau
Không phải cứ có hình xăm đều là hổ báo
Anh thanh niên thợ cắt tóc không hề ngổ ngáo
Không phải về nhà rất khuya đều là ăn chơi
Chị phóng viên ngừng tay viết khi bóng trăng rơi
Không chịu ló mặt ra đường, không phải lười nhác
Anh kiến trúc sư đang hoàn thiện ngôi nhà người khác
Không phải cứ ngáp ngắn ngáp dài đều là tệ nạn đâu
Anh nhạc sĩ đó thường viết nhạc xuyên màn đêm thâu
Có nhiều khi mà đôi mắt mình nói sai
Mình nghi ngờ mọi thứ rồi buông lời chói tai
Ngọn lửa chân thành không thể nào mà gói lại
Mở lòng ra đón những tốt đẹp từ sớm mai

Hướng đôi mắt về phía mặt trời
Tâm hồn tắm trong ánh xuân ngời
Tết mà không gắn kết, sẽ buồn hết cả năm
Bao hoài nghi và những u sầu
Xóa đi hết đừng để trong đầu
Mỗi ngày trong năm sẽ vui như Tết nếu mình gần nhau
Sống mà cứ hoài nghi như tự mình nhảy vào trong cát lún
Thay vì thoát ra, mà lại cố để kéo người khác xuống
Cuộc đời này đủ phức tạp, đừng có nghĩ quá xa xôi
Những chuyện buồn thì buông hết, điều tốt đẹp chớ phai phôi
Ôm trong lòng nhiều hoài nghi, tâm hồn như là tổ ong đó
Làm sao giữ được chân thành khi đựng niềm tin ở trong đó
Tin vào điều tốt đẹp để đôi mắt luôn sáng và trong
Gần nhau hơn trong ngày giáp tết, điều đó thật đáng mà mong
Ném đi những nghi kị cho đỡ chật nhà
Mình lại ngồi gần bên nhau nói lời thật thà
Cho những cành khô héo sẽ lại đơm hoa
Và một năm mới rực rỡ như lon Coca

Hướng đôi mắt về phía mặt trời
Tâm hồn tắm trong ánh xuân ngời
Tết mà không gắn kết, sẽ buồn hết cả năm
Bao hoài nghi và những u sầu
Xóa đi hết đừng để trong đầu
Mỗi ngày trong năm sẽ vui như Tết nếu mình gần nhau"
FzNBhGz_hlw,Cũng Đành Thôi,Cũng Đành Thôi,ĐỨC PHÚC OFFICIAL,"2 Contributors
Cũng Đành Thôi Lyrics
Em gọi anh lúc 3h sáng
Anh lặng nghe rất êm từng tiếng thở
Hai tuần ta cách xa rồi đấy
Chắc giờ anh cũng không còn bất ngờ
Lời chia tay em giữ thật lâu
Và giờ đây thì cũng đã nên câu
Từng lời như vết cắt rất sâu
Hạt mưa đêm như rơi vào tim
Và không gian dường như quá đắm chìm
Một người gặp mấy lặng im
Em muốn quên đi chuyện lúc xưa
Anh cũng không quan tâm em hơn nữa
Trong chúng ta đâu ai có quyền níu kéo được nhau
Em muốn quên đi bao tháng ngày
Anh cũng mong 2 ta cùng giữ lấy
Những giấc mơ khi xưa khép lại theo gió nhẹ trôi
Thôi cũng đành thôi
Một hai câu chia tay rồi thôi
Và cứ thế thời gian vẫn cứ trôi
Rằng tình yêu nơi đâu mất rồi
Liêu rằng em nơi phương trời xa
Tình yêu đó còn vương vấn thiết tha và lòng em có nhớ ta?

Em muốn quên đi chuyện lúc xưa
Anh cũng không quan tâm em hơn nữa
Trong chúng ta đâu ai có quyền níu kéo được nhau
Em muốn quên đi bao tháng ngày
Anh cũng mong 2 ta cùng giữ lấy
Những giấc mơ khi xưa khép lại theo gió nhẹ trôi
Thôi cũng đành thôi
Thôi cũng đành thôi
Thôi cũng đành thôi
Em muốn quên đi chuyện lúc xưa
Anh cũng không quan tâm em hơn nữa
Trong chúng ta đâu ai có quyền níu kéo được nhau
Em muốn quên đi bao tháng ngày
Anh cũng mong 2 ta cùng giữ lấy
Những giấc mơ khi xưa khép lại theo gió nhẹ trôi
Em muốn quên đi chuyện lúc xưa
Anh cũng không quan tâm em hơn nữa
Trong chúng ta đâu ai có quyền níu kéo được nhau
Em muốn quên đi bao tháng ngày
Anh cũng mong 2 ta cùng giữ lấy
Những giấc mơ khi xưa khép lại theo gió nhẹ trôi
Thôi cũng đành thôi..."
