Video_ID,Raw_Title,Clean_Title,Uploader,Lyric
1Cpjv6hZH6A,Từng Lầm Lỗi - Lê Bảo Bình,Từng Lầm Lỗi,Lê Bảo Bình,"1 Contributor
Lời Cám Ơn Lyrics
Hoàng Oanh
, 
Như Quỳnh
, 
Quang Lê
]
Người đã cho tôi hơi ấm quê hương, tình người
Vượt sóng ra khơi, lòng tràn dâng nỗi nhớ một trời
Thành phố hôm xưa giờ đã mù khơi
Bật khóc trong tay, buồn nào theo gió xa bay
Thuỷ Tiên
, 
Lưu Bích
, 
Lương Tùng Quang
]
Người đã cho tôi tiếng nói, con tim hiền hoà
Đầy chứa thương yêu dù cho mưa gió cuốn nhạt nhoà
Gọi tiếng ""anh ơi"", cùng góp bàn tay
Gọi tiếng ""em ơi"", cùng chung lấp nỗi đau đoạ đày
Giọng hát bay cao, lời cảm ơn sâu
Từng người đã góp phần cho nương náu
Từng người đã cùng nhau chung sức đắp xây tình thương
Một nhà Việt Nam dấu yêu
Hồ Lệ Thu
, 
Vân Quỳnh
, 
Tất cả
]
Tình vẫn trôi quanh theo nước long lanh về nguồn
Thả ánh trăng thanh, về đây soi sáng giấc mộng lành
Nhìn cuối chân mây chợt thấy bình yên
Người đã cho tôi niềm tin mới yêu thương cuộc đời

Thế Sơn
, 
Loan Châu
, 
Nguyễn Hưng
]
Người đã cho tôi tia nắng yêu thương nồng nàn
Rọi sáng hôm nay, vượt qua tăm tối dẫu muộn màng
Ngày tháng lưu vong dệt những mùa xuân
Cùng kết ân tình, ngàn đời tô thắm nhân sinh
Như Loan
, 
Trần Thái Hoà
, 
Dương Triệu Vũ
]
Người đã cho tôi hoa lá xinh tươi địa đàng
Bằng trái tim rung, hoà nhịp chung cõi ấm tình người
Này những đôi tay gạch nối niềm tin
Dìu lối tôi qua bao nguy khốn chông gai cực hình
Giọng hát bay cao, lời cảm ơn sâu
Từng người đã góp phần cho nương náu
Từng người đã cùng nhau chung sức đắp xây tình thương
Một nhà Việt Nam dấu yêu
Bằng Kiều
, 
Khánh Hà
, 
Tuấn Ngọc
]
Hạnh phúc trong tay xin mãi hiến dâng gọi mời
Ngồi xuống nơi đây, cùng nhau vui hát khúc nhạc này
Và bước chân lên vùng đất tự do
Người đã cho tôi tương lai sáng chứa chan nụ cười
Người đã cho tôi tương lai sáng chứa chan nụ cười
Lời cảm ơn anh, lời cảm ơn em
Lời cảm ơn riêng dành cho người"
RQ7q1epdRxA,Muốn Khóc Thật To,Muốn Khóc Thật To,Trúc Nhân,
o6Brv_awCwU,I Don't Believe In You | Noo Phước Thịnh ft. Basik ( Lyrics Video),I Dont Believe In You,Noo Phước Thịnh,"1 Contributor
I Don’t Believe in You Lyrics
Em nói dối, đã hứa rằng mai không xa rời
Vậy mà giờ đây còn riêng mình anh thôi
Bao yêu thương ngày nào người mang đi hết những ngọt ngào
Còn một mình anh ôm cô đơn thét gào
Anh nói dối, anh đã quên em lâu rồi
Bao yêu thương người trao, bao ngây ngô ngày nao giờ tan theo khói mây
Anh yêu ai khác đây, chúc em tìm được niềm vui mới
Đừng trong mong chi anh sẽ quên những gì đã qua
Chẳng thể nào ngững nghĩ đến em hỡi người
Không cần em, khôn cần yêu sao vẫn mơ về em quá nhiều
Và chỉ còn một mình riêng anh đợi chờ người ngày dài thâu đêm
Mỏi mòn, héo hon cô đơn mình anh với anh
Now I don't believe in you, now I don't believe in you
Chẳng thể tin ai nói ""Mãi mãi sẽ chẳng phai""
Now I can't believe in you and now I can't believe in you
Đã chia lìa, đừng nhắc tên nhau làm chi hỡi em
Yeah, now I don't believe in you
이젠 찾을 수 없지, 널 믿을 이유
친구들이 어떻냐고 묻지만
떠오르지가 않았지, 적절한 비유
우리가 끝난 후에도 사랑을 믿고 싶었지만
이야기의 끝에 가서 미소를 짓고 싶었지만
너와 나, 다른 책을 읽었던 것 같아
내 사랑이 조금 더 질렸던 것 같아

Anh nói dối, anh đã quên anh lâu rồi
Bao yêu thương người trao, bao ngay ngô ngày nao giờ tan theo khói mây
Anh yêu ai khác đây, chúc em tìm được niềm vui mới
Đừng trong mong chi anh sẽ quên những gì đã qua
Now I don't believe in you, now I don't believe in you
Chẳng thể tin ai nói ""Mãi mãi sẽ chẳng phai""
Now I can't believe in you and now I can't believe in you
Đã chia lìa, đừng nhắc tên nhau làm chi hỡi em
Yeah, 사실 믿지 않는 게 아니라 못 믿는 거지
내 의지와는 상관없이 못 잊는 거지
내가 네게 부렸었던 모든 고집은 거의 다
쓸데없는 자존심들, 돌릴 순 없겠지
Now I don't believe in you
No, I can't bеlieve in you
우리 아직 뭔가 있냐고 물으면 I still think we do
말할 수 있어 이제 널 잊었다고
안 믿어도 돼, 나도 널 안 믿는다고
I don't bеlieve in you anymore

Now I don't believe in you, now I don't believe in you
Chẳng thể tin ai nói ""Mãi mãi sẽ chẳng phai""
Now I can't believe in you and now I can't believe in you
Đã chia lìa, đừng nhắc tên nhau làm chi hỡi em
Anh nói dối, anh đã quên em lâu rồi
Anh quên em lâu rồi"
J1El7qfbeI0,Bài Tình Ca Cho Em......nhạc tình buồn cho những chàng 'Quân Tử' thất tình..😍,Bài Tình Ca Cho Em,Hoàng Quân - Những bản tình ca bất hủ ,
QQXjaRVh4tQ,Một Cái Tên - Chillies ft. Orange (Official Lyric Video),Một Cái Tên,Chillies,"2 Contributors
Một Cái Tên Lyrics
Phía xa mình
Nhìn nhau và không nói câu gì
Vì sau đêm nay chúng ta
Bước theo hai lối ra
Cứ im lặng ngồi đây
Và ly whisky không còn say
Như em với ta
Chờ những âm thanh vỡ ra
Và ngày còn chờ ai với ai
Ngọt ngào này còn theo đến tai
Nguyện thề này còn ai giữ mãi
Khi em ở trong vòng tay của một ai khác đêm nay
Và dường như đã quên
Điệu nhạc buồn này ai cất lên
Để lại một hành tinh đã chết
Theo đêm tàn trên đầu môi em thôi nhung nhớ một cái tên
Có bao nhiêu lần đau
Thì ta cũng không là của nhau
Như lời dối gian
Đừng nhắc cho tim vỡ tan

Có bao nhiêu lần say
Thì anh cũng không quay về đây
Mong chờ nữa chi
Mình uống cho quên hết đi
Và ngày còn chờ ai với ai
Ngọt ngào này còn theo đến tai
Nguyện thề này còn ai giữ mãi
Khi em ở trong vòng tay của một ai khác đêm nay
Và dường như đã quên
Điệu nhạc buồn này ai cất lên
Để lại một hành tinh đã chết
Theo đêm tàn trên đầu môi em thôi nhung nhớ một cái tên
Vậy đây là đêm cuối bên nhau
Với những đắm say
Đừng chờ đợi gì vết thương sâu
Chẳng thể níu tay
Ngày qua mình có thấy vui hơn
Anh cứ bước đi
Và một lần để cho trái tim đau
Trái tim đau

Và ngày còn chờ ai với ai
Ngọt ngào này còn theo đến tai
Nguyện thề này còn ai giữ mãi
Khi em ở trong vòng tay của một ai khác đêm nay
Và dường như đã quên
Điệu nhạc buồn này ai cất lên
Để lại một hành tinh đã chết
Theo đêm tàn trên đầu môi em thôi nhung nhớ một cái tên"
WqR-S6jLRHk,LÝ RAPPER  - TIÊU MINH PHỤNG | Sự kết hợp đặc biệt Rap và Cải Lương khiến RAP VIỆT 2024 Bùng Nổ,Lý Rapper - Tiêu Minh Phụng,Tiêu Minh Phụng Official,
JlQSAS_ccxw,Thấy Trung Nhân Giữa Thiên Hạ | Phan Mạnh Quỳnh x Tăng Duy Tân (Prod.by Drum7) | OFFICIAL MV,Thấy Trung Nhân Giữa Thiên Hạ,Phan Mạnh Quỳnh Official,"1 người đóng góp
Lời bài hát này vẫn chưa được chép lời. Vui lòng kiểm tra lại sau khi bài hát được phát hành."
HmaSlXp68oQ,TỰ THÂN MÌNH ĐI - DANH TUẤN TRUNG | MV OFFICIAL | Bao Năm Trôi Qua Sao Đời Ta Vẫn Chưa Nở Hoa...,Tự Thân Mình Đi,Danh Tuấn Trung Official,
WFpMtnXjFRY,Trái đất ôm Mặt trời - KAI ĐINH x GREY D x AMEE | from ‘SUMMEROOM’ Band Session,,Kai Dinh Official,"19 người đóng góp
Bản dịch
tiếng Nhật
RADWIMPS - Nandemonaiya (Phiên bản phim) (La Mã) Lời bài hát
Futari no aida toorisugita kaze wa
Doko kara sabishisa wo hakondekita no
Naitari shita sono ato no sora wa
Yake ni sukitootteitari shitanda
Itsumo wa togatte tachichi no kotoba ga
Kyou wa atatakaku kanjimashita
Yasashisa mo egao mo yume no katarikata mo
Shiranakute zenbu kimi wo maneta yo
Mou sukoshi dake de ii ato sukoshi dake de ii
Mou sukoshi dake de ii kara
Mou sukoshi dake de ii ato sukoshi dake de ii
Mou sukoshi dake kuttsuiteiyou ka
Bokura taimufuraiyaa toki wo kakeagaru kuraima
Toki no kakurenbo hagurekko wa mou iya nanda
Ureshikute naku nowa kanashikute warau bây giờ
Kimi no kokoro ga kimi wo oikoshitanda yo
Hoshi ni made negatte te ni ireta omocha mo
Heya no sumikko ni ima korogatteru
Kanaetai yume mo kyou de hyakko dekita yo
Tatta hitotsu to itsuka koukanko shiyou
Itsumo wa shaberanai ano ko ni kyou wa
Houkago ""mata ashita"" to koe wo kaketa
Narenai koto mo tama ni nara ii ne
Toku ni anata ga tonari ni itara

Mou sukoshi dake de ii ato sukoshi dake de ii
Mou sukoshi dake de ii kara
Mou sukoshi dake de ii ato sukoshi dake de ii
Mou sukoshi dake kuttsuiteiyou yo
Bokura taimufuraiyaa kimi wo shitteitanda
Boku ga boku no namae wo oboeru yori zutto mae ni
Kimi no inai sekai ni mo
Nanika no imi wa kitto atte
Demo kimi no inai sekai nado
natsuyasumi no nai hachigatsu không bạn
Kimi no inai sekai nado
Warau koto nai santa no you
Kimi no inai sekai nado
Bokura taimufuraiyaa toki wo kakeagaru kuraimaa
Toki no kakurenbo hagurekko wa mou iya nanda
Nandemo nai ya yappari nandemo nai ya
Ima kara iku yo
Bokura taimufuraiyaa toki wo kakeagaru kuraimaa
Toki no kakurenbo hagurekko wa mou ii yo
Kimi wa hade na kuraiyaa sono namida tometemitai na
Dakedo kimi wa kobanda
Koboreru mama no namida wo mite wakatta
Ureshikute naku no wa kanashikute warau nowa
Boku no kokoro ga boku wo oikoshitanda yo"
zcJr0KtkfWM,Xóm Đêm - Lệ Quyên,Xóm Đêm,Lệ Quyên,"1 Contributor
Xóm Đêm Lyrics
Đường về canh thâu
Đêm khuya ngõ sâu như không mầu
Qua phên vênh có bao mái đầu
Hắt hiu vàng ánh điện câu
Đường dài không bóng
Xa nghe tiếng ai ru mơ màng
Mưa rơi rơi xóa lối đi mòn
Có đôi lòng vững chờ mong
Ai chia tay ai đầu xóm vắng im lìm
Ai rung lên tia mắt ngàn câu êm đềm
Mong sao cho duyên nghèo mai nắng gieo thêm
Đẹp kiếp sống thêm
Màn đêm tịch liêu
Nghe ai thoáng ru câu mến trìu
Nghe không gian tiếng yêu thương nhiềụ
Hứa cho đời thôi đìu hiu
Đêm tha hương ai vọng trông
Đêm cô liêu chinh phụ mong
Đêm bao canh mưa âm thầm
Theo gió về khua cơn mộng
Hẹn mai ánh xuân nồng

Cho nên đêm còn dậy hương
Để dìu bước chân ai trên đường
Để nhìn xóm khuya không buồn
Vì người biết mang tình thương
Ai chia tay ai đầu xóm vắng im lìm
Ai rung lên tia mắt ngàn câu êm đềm
Mong sao cho duyên nghèo mai nắng gieo thêm
Đẹp kiếp sống thêm
Màn đêm tịch liêu
Nghe ai thoáng ru câu mến trìu
Nghe không gian tiếng yêu thương nhiềụ
Hứa cho đời thôi đìu hiu
Hứa cho đời thôi đìu hiu"
Ol-4SKivGnU,Người Phản Bội - Lê Bảo Bình,Người Phản Bội,Lê Bảo Bình,"4 Contributors
Người Phản Bội Lyrics
Màn đêm buông xuống
Căn phòng lạnh lẽo
Anh thấy cô đơn
Anh thấy mỏi mệt và anh nhớ về người
Anh nhớ nụ cười của em
Chạy theo những cuộc vui xa hoa thâu đêm
Và em đã quên đi tình yêu anh trao em
Để giờ đây em mãi bước ra khỏi cuộc đời anh
Anh sẽ chấp nhận hết tất cả những điều
Vì anh quá yêu, anh quá nuông chiều
Để em lừa dối em đã phản bội rồi đổi thay
Anh sẽ tiếp tục sống những ngày vắng em
Và sẽ tập cho mình một thói quen
Để em sẽ hối tiếc về tất cả những gì em đã gây ra
Anh hãy chắc anh đã quên em
Khi chia đôi hai ta xa nhau (ha-ha—)
Anh hãy chắc anh đã quên em
Khi chia đôi hai ta xa nhau (ha-ha—)

Màn đêm buông xuống
Căn phòng lạnh lẽo
Anh thấy cô đơn
Anh thấy mỏi mệt và anh nhớ về người
Anh nhớ nụ cười của em
Chạy theo những cuộc vui xa hoa thâu đêm
Và em đã quên đi tình yêu anh trao em
Để giờ đây em mãi bước ra khỏi cuộc đời anh
Anh sẽ chấp nhận hết tất cả những điều
Vì anh quá yêu, anh quá nuông chiều
Để em lừa dối em đã phản bội rồi đổi thay
Anh sẽ tiếp tục sống những ngày vắng em
Và sẽ tập cho mình một thói quen
Để em sẽ hối tiếc về tất cả những gì em đã gây ra
Anh sẽ chấp nhận hết tất cả những điều
Vì anh quá yêu anh quá nuông chiều
Để em lừa dối em đã phản bội rồi đổi thay
Anh sẽ tiếp tục sống những ngày vắng em
Và sẽ tập cho mình một thói quen
Để em sẽ hối tiếc về tất cả những gì em đã gây ra

Để em sẽ hối tiếc về tất cả những gì em đã gây ra"
jzYJDsgNKKc,BINZ x SLIMV - QUÊN ANH ĐI (Official MV),Quên Anh Đi,Binz Da Poet,"3 Contributors
Quên Anh Đi Lyrics
Tin nhắn đêm qua anh vẫn còn chưa xem
Anh nhớ không ra, ta đã vui bao đêm
Giờ này em ở đâu
Không cần cho anh biết
Giữ lại những cảm xúc
Ta phải nhớ nhau chi
Tốt hơn em không nên dại khờ (Oh-oh-oh) (Baby)
Tình yêu không như cầu vồng
Quên tên nhau là xong
Baby thôi em không nên chờ (Oh-oh-oh)
Lòng tin anh như ngày hạ
Và tim anh như mùa đông
Baby tốt nhất em hãy quên a-a-a-anh
Tốt nhất em hãy quên a-a-a-anh
Tốt nhất em hãy quên a-a-a-anh
Tốt nhất em hãy quên a-a-a-anh
*Thôi em không nên chờ*
*Thôi em không nên chờ*
*Quên tên nhau là xong, quên tên nhau đi baby (không nên chờ)*
*Thôi em không nên chờ*
*Thôi em không nên chờ*
*Quên tên nhau là xong, quên tên nhau đi baby*

Quên khi bên nhau (Ah)
Khi đêm nay qua (Ah)
Ok em đau (Ah)
Là do anh gây ra (Ah)
“Đừng xa em đêm nay"" (Eh)
""Đừng đi khi em say” (Eh)
Mộng mơ do em xây lên
Vần thơ anh đem thay tên
Sai người em dù sao đã trót
Em đâu cần liên tục order shot
Không còn đủ tỉnh táo để son lại môi
Kẻ mắt thật đẹp cũng chỉ để khóc
Ngay từ đầu không cần chọn anh để tin
Trò chơi tình yêu em không thể win
Những gì em cần anh cho được hết
Chỉ là riêng tình yêu em đâu thể xin
(Listen)
Dường như em nghĩ
Tình yêu luôn kết
Đẹp như series phim em đã xem hay sao?
Dù anh đã nói
Niềm đau phía trước
Rồi sẽ cắt con tim em như dao (Baby)

Tốt nhất em hãy quên a-a-a-anh
Tốt nhất em hãy quên a-a-a-anh
Tốt nhất em hãy quên a-a-a-anh
Tốt nhất em hãy quên anh đi luôn, tin nhau chi
Vì tình yêu anh không như trên TV đâu
*Thôi em hông nên khờ*
*Thôi em hông nên khờ*
*Quên tên nhau là xong, quên tên nhau đi baby*
Không nên khờ
*Baby thôi! quên tên anh đi*
*Baby thôi! quên tên a-a-a-anh*
Thôi em hông nên khờ (Oh-oh-oh)
Tình yêu không như cầu vồng
Quên tên nhau là xong
Baby thôi em không nên chờ (Oh-oh-oh)
Lòng tin anh như ngày hạ
Và tim anh như mùa đông
Baby tốt nhất em hãy...
Tốt nhất em hãy..."
1BmCiJA_w7U,Nỗi Nhớ Mưa Phai l Sáng tác: An Phương l,,MẠNH QUỲNH OFFICIAL,"19 người đóng góp
Bản dịch
tiếng Nhật
RADWIMPS - Nandemonaiya (Phiên bản phim) (La Mã) Lời bài hát
Futari no aida toorisugita kaze wa
Doko kara sabishisa wo hakondekita no
Naitari shita sono ato no sora wa
Yake ni sukitootteitari shitanda
Itsumo wa togatte tachichi no kotoba ga
Kyou wa atatakaku kanjimashita
Yasashisa mo egao mo yume no katarikata mo
Shiranakute zenbu kimi wo maneta yo
Mou sukoshi dake de ii ato sukoshi dake de ii
Mou sukoshi dake de ii kara
Mou sukoshi dake de ii ato sukoshi dake de ii
Mou sukoshi dake kuttsuiteiyou ka
Bokura taimufuraiyaa toki wo kakeagaru kuraima
Toki no kakurenbo hagurekko wa mou iya nanda
Ureshikute naku nowa kanashikute warau bây giờ
Kimi no kokoro ga kimi wo oikoshitanda yo
Hoshi ni made negatte te ni ireta omocha mo
Heya no sumikko ni ima korogatteru
Kanaetai yume mo kyou de hyakko dekita yo
Tatta hitotsu to itsuka koukanko shiyou
Itsumo wa shaberanai ano ko ni kyou wa
Houkago ""mata ashita"" to koe wo kaketa
Narenai koto mo tama ni nara ii ne
Toku ni anata ga tonari ni itara

Mou sukoshi dake de ii ato sukoshi dake de ii
Mou sukoshi dake de ii kara
Mou sukoshi dake de ii ato sukoshi dake de ii
Mou sukoshi dake kuttsuiteiyou yo
Bokura taimufuraiyaa kimi wo shitteitanda
Boku ga boku no namae wo oboeru yori zutto mae ni
Kimi no inai sekai ni mo
Nanika no imi wa kitto atte
Demo kimi no inai sekai nado
natsuyasumi no nai hachigatsu không bạn
Kimi no inai sekai nado
Warau koto nai santa no you
Kimi no inai sekai nado
Bokura taimufuraiyaa toki wo kakeagaru kuraimaa
Toki no kakurenbo hagurekko wa mou iya nanda
Nandemo nai ya yappari nandemo nai ya
Ima kara iku yo
Bokura taimufuraiyaa toki wo kakeagaru kuraimaa
Toki no kakurenbo hagurekko wa mou ii yo
Kimi wa hade na kuraiyaa sono namida tometemitai na
Dakedo kimi wa kobanda
Koboreru mama no namida wo mite wakatta
Ureshikute naku no wa kanashikute warau nowa
Boku no kokoro ga boku wo oikoshitanda yo"
ehbyxoSVBE0,MÙA XUÂN TRONG THƯ EM - ĐÀM VĨNH HƯNG | OFFICIAL LYRICS VIDEO,MÙA XUÂN TRONG THƯ EM,Đàm Vĩnh Hưng,"1 Contributor
Mùa Xuân Trong Thư Em Lyrics
Thư viết từ miền xa
Gửi về em gái tôi thương chưa quen mặt
Năm nay đơn vị anh vui đón xuân
Bằng những lời em gái viết trong thư
Xuân núi rừng rộn vui
Mấy thằng khoe có khăn thêu em tặng
Những chiến binh đọc thư ghi chép nhanh
Hình như những gian truân giờ tiêu tan
Thư em là ngàn câu thơ
Là câu đối đỏ, là thịt mỡ dưa hành
Khăn thêu là ngàn cánh mai
Là ưu ái ngọc ngà cho lính trận ngoài biên
Tôi có gì tạ ơn
Những người em gái xa xôi nơi đô thị
Xin ghi vội vài câu thơ thất ngôn
Là tất cả chân thành gửi về em!"
KUg_RGkcfW0,Wxrdie - Vẫn Đợi [feat. wokeupat4am & 2pillz] | Official MV,Vẫn Đợi,Wxrdie,"1 Contributor
Vẫn Đợi Lyrics
Young Wxrdie
Imma super lonely boi
Baby, anh đang ở ngay kế
420 ngày để chờ được chạm vào đôi bàn tay bé
Nước mắt khẽ rơi khi vô tình lại lượn qua nơi ta hay ghé
Tốt thôi, anh đã được huấn luyện để trở thành một người thay thế
Anh biết thừa là chuyện này đâu dễ
Cất nó đi, không phải miếng mồi để cho truyền thông sâu xé
Vẫn đứng sau cánh gà lặng thầm nhìn theo một cô bé
Nếu vẫn chưa đến cảnh của anh ừ thì là có lẽ
Em có thể ở lại hoặc là đi mất
Sẽ vẫn yêu em như này dù hôm nay là ngày duy nhất
Anh không khóc đâu chỉ là vì làn khói này làm nhòe mi mắt
Giáng Sinh năm nay lại viết tên em và bỏ vào bít tất
Chẳng còn thời gian cho em giận dỗi
Chẳng còn thời gian cho anh cầm cối
Ừ thì quay mặt đi và bỏ lại riêng mình anh đần thối
Chỉ có mỗi anh trong căn phòng tối vẫn ngồi
Đã hết kiên nhẫn rồi
Có lẽ anh vẫn đợi, vẫn đợi

Cho anh một lần được làm ông tướng
Dù biết đến với nhau sau này sẽ gặp nhiều điều không mong muốn
Trút hết ra khay nhưng mà hôm nay anh lại không cuốn
Liệu rằng có ai tới đón em trước khi cơn mưa dông xuống
Em đã đạt được điều mà mình mơ ước
Chắp tay nguyện cầu anh thầm mong cho em được sung sướng
Cơn noid kéo anh đi mỗi khi thấy em cùng ai chung bước
Mọi thứ chẳng có cách nào để trở về được như trước
Em đâu hay anh đang ở ngay kế
420 ngày đợi chờ để chạm vào đôi bàn tay bé
Nước mắt khẽ rơi khi vô tình lại lượn qua nơi ta hay ghé
Tốt thôi, anh đã được huấn luyện để trở thành một người thay thế
Chẳng còn thời gian cho em giận dỗi
Chẳng còn thời gian cho anh cầm cối
Ừ thì quay mặt đi và bỏ lại riêng mình anh đần thối
Chỉ có mỗi anh trong căn phòng tối, vẫn ngồi
Đã hết kiên nhẫn rồi
Nhưng mà có lẽ anh vẫn đợi, vẫn đợi"
JgdXcwuggpU,Miền An Nhiên - Phạm Minh Thành [Official Music Video],Miền An Nhiên,Sony Music Entertainment Vietnam,
yrlFv0-hkWE,Lặng Yên | Bùi Anh Tuấn ft Ái Phương - OST Lặng yên dưới vực sâu,Lặng Yên,VTV Giải Trí Official,"3 người đóng góp
Lời bài hát Chỉ Giấc Mơ
Ước mơ của tôi là đến được mặt trăng và
Bay lên đó trong không gian
Muốn theo đuổi khắp thế giới
Tham gia bài hát của tôi
Tôi sẽ cưỡi giấc mơ của mình
Miễn là bạn ở bên tôi, có ánh sáng
Tôi sẽ cưỡi giấc mơ của mình
Chỉ cần trái tim anh là em thì vẫn còn ánh sáng
Có người cầu nguyện mỗi đêm
Tôi muốn được chú ý
Chỉ đuổi theo vòng quanh thế giới
Tham gia bài hát của tôi
Tôi sẽ cưỡi giấc mơ của mình
Miễn là bạn ở bên tôi, có ánh sáng
Tôi sẽ cưỡi giấc mơ của mình
Chỉ cần trái tim anh là em thì vẫn còn ánh sáng

Tôi sẽ cưỡi giấc mơ của mình
Miễn là bạn ở bên tôi, có ánh sáng
Tôi sẽ cưỡi giấc mơ của mình
Chỉ cần trái tim anh là em thì vẫn còn ánh sáng
(Tôi sẽ cưỡi giấc mơ của mình)
Chỉ là một giấc mơ, chỉ là một giấc mơ
(Chỉ cần ở bên em là có ánh sáng)
Chỉ là một giấc mơ, chỉ là một giấc mơ
(Tôi sẽ cưỡi giấc mơ của mình)
Chỉ là một giấc mơ, chỉ là một giấc mơ
(Chỉ cần trái tim anh là em thì còn có ánh sáng)
Chỉ là một giấc mơ"
igvsyOvrnOY,[OFFICIAL] MÂY ĐÊM CHỜ MẤY ĐÊM - NGUYỄN HỮU KHA,Mây Đêm Chờ Mấy Đêm,Nguyễn Hữu Kha Official,"1 Contributor
Mây Đêm Chờ Mấy Đêm Lyrics
Tình nào ai không giữ lấy
Cho nhau mãi đi tìm một ngày trôi qua vẫn đấy
Ưu tư tràn về sát đêm
Tìm về nhau nỗi nhớ
Mây đêm mấy đêm dài
Ngồi bên hiên nhà nhớ mong đến một người đã rất thương
Dặn dò tim mình sẽ thôi đớn đau lấy thêm u sầu
Bao nhiêu lâu ở gần bên nhau
Để giờ này vỡ tan
Mang cô đơn giày vò tim can để rồi
Sai đêm nay là say đêm mai
Ai còn ai vấn vương
Biết được rằng nếu xa đâu thể
Quay lại
Buồn vì yêu không giữ gìn
Yêu nhau nào nghĩ cho nhau
Trong cơn mưa thẳm sâu thi
Ta đâu nào hay biết trước
Xước đôi mi người tuôn sầu
Đau khi vội lướt qua nhau
Sau bao nhiêu cuộc vui đời thường
Ngổn ngang ta mất nhau rồi

Biết em là thơ
Giấu em vào mơ
Nắng lên chạm lấy
Đôi môi này hững hờ
Cớ sao đậm sâu
Vấn vương gì đâu
Ngồi đây mà vẫn
Chờ .... Ai tới
Yêu thương kia là mây là mấy chờ
Mơ cơn mơ ưu tư là mấy đợi
Đợi chờ ai thương ai là mây nghàn
Tàn cuộc vui đêm nay người nhớ ai
Yêu thương kia là mây là mấy chờ
Mơ cơn mơ ưu tư là mấy đợi
Đợi chờ ai thương ai là mây nghàn
Tịch tình tan mây đêm chờ mấy đêm
Gọi mờii !"
