Video_ID,Raw_Title,Clean_Title,Uploader,Lyric
2hGQePcAr2U,Because I'm Stupid (Mất Em) -  Noo Phước Thịnh「Official Lyrics Video」,Because Im Stupid,Mưa.,"8 người đóng góp
Bản dịch
한국어 (tiếng Hàn)
Tiếng Anh
Kim Hyun Joo (김현중) - 내 머리가 나빠서 (Vì tôi ngu ngốc) (Acoustic Ver.) (La Mã) Lời bài hát
Người học không hề nghỉ ngơi.
Neo không có gì để ăn.
Dareun Saramel Bogo Neon
Lợi thế của Ireon naemaeumdo, mm
Tìm hiểu tên của eopgetji
Tto lựa chọn eopgetjiman
Neoman chạy ngày hôm qua
Xin vui lòng đọc bài viết này
Neoui DwettMoseubeul
Xương ở Haengbogiya
Làm móng hoàn thiện với mollado
Kkennae là gado
Không ai tự hào về nhau.
Neomu đưa cho anh ấy một nareneun
Neoreul Saranghanda Ipgae Maemdora
Honja dasi đang khóc vì em
Honja dasi tto thiếu cho bạn
Em ơi, anh yêu em, anh đang đợi em
Tìm hiểu tên của eopgetji
Trò chơi ttto eopgetjiman
Đập Neoman bogo hôm nay
Honja muốn rời bỏ điều này

Naege tổ lá sangcheo của bạn
Mọi người đều đau khổ và buồn bã.
Trong thành tựu cũ
Không ai có liên quan gì đến nó.
Gaseum 100 gram nareneun
Không có eemdo ipgae kiêu ngạo
Honja dasi đang khóc vì em
Honja dasi tto thiếu cho bạn
Em ơi, anh yêu em, anh đang đợi em
Bye, bye, không bao giờ nói lời tạm biệt (Không bao giờ nói lời tạm biệt)
Ireoke chịu trách nhiệm về motajman (motae chịu trách nhiệm)
Tôi cần bạn amumaldo motae
Tôi muốn bạn mãi mãi dasi mãi mãi
Không ai tự hào về họ.
Neomu đưa cho anh ấy một nareneun
Neoreul Saranghanda Ipgae Maemdora
Honja dasi đang khóc vì em
Không ai có liên quan gì đến nó.
Gaseum 100 gram nareneun
Không có eemdo ipgae kiêu ngạo
Honja dasi đang khóc vì em
Honja dasi tto thiếu cho bạn
Em ơi, anh yêu em, anh đang đợi em"
64yR2HnMgVk,NƠI DÀNH CHO CÁC THIÊN THẦN - PHAN MẠNH QUỲNH | ANIMATION VIDEO,NƠI DÀNH CHO CÁC THIÊN THẦN,Phan Mạnh Quỳnh Official,"1 Contributor
Nơi Dành Cho Các Thiên Thần Lyrics
Em ấy cười mẹ em vui
Ước mơ của mẹ
Là em tươi nét môi
Ngày mà cô bé ấy
Sinh ra thành dáng hình
Một đôi cánh
Đã giữ trên cao bởi thần linh
Em đã về một nơi xa
Trái tim bé nhỏ
Ngừng lại khi ấu thơ
Làm như thể thế giới
Chẳng đáng để em ở
Vậy nên em nỡ khiến
Bao tâm hồn chơ vơ
Vì em yêu những đám mây
Vì em luôn yêu những đám mây
Nên em theo mây về nơi kia rồi
Em xa trần gian rất vội
Và từ đó em mãi bé thơ
Chuyện về em như những cơn mưa
Rơi xuống lòng người khô hạn
Còn em ở nơi
Nơi dành cho các Thiên Thần
Ở nơi dành cho các Thiên Thần
Trên biển lặng và sóng rất êm
Những đôi mắt hướng lên cao
Rồi hướng vô tim
Ngày mà cô bé ấy
Bay đi vào vĩnh hằng
Người ta bỗng thấy
Mến thương hơn từ trong tâm
Vì em yêu những đám mây
Vì em luôn yêu những đám mây
Nên em theo mây về nơi kia rồi
Em xa trần gian rất vội
Và từ đó em mãi bé thơ
Chuyện về em như những cơn mưa
Rơi xuống lòng người khô hạn
Còn em ở nơi
Nơi dành cho các Thiên Thần
Xin nghĩ về em
Ngoài giọt lệ ướt nhòa
Hãy nhớ xướng ca
Vì giờ trên cõi thiên đàng
Một đôi cánh
Đang vút cao bay trong hoan lạc
Khi thiên thu đi qua nơi trần gian
Mẹ ôm em nữa nhé
Là ngày gặp nhau giữa mây ngàn
Chẳng còn hợp tan chia xa
Vì em yêu những đám mây
Vì em luôn yêu những đám mây
Nên em theo mây về nơi kia rồi
Em xa trần gian rất vội
Và từ đó em mãi bé thơ
Chuyện về em thành những cơn mưa
Rơi xuống lòng người khô hạn
Còn em ở nơi
Nơi dành cho các Thiên Thần
Ở nơi dành cho
Ở nơi dành cho
Ở nơi dành cho
Nơi dành cho các Thiên Thần
Nơi dành cho các Thiên Thần"
IurU1c1eAas,VỀ NHÀ ĂN TẾT 2 - DOUBLE2T x JUSTATEE x BIGDADDY | OFFICIAL MV,VỀ NHÀ ĂN TẾT 2,JustaTeeMusic,"2 Contributors
Về Nhà Ăn Tết 2 Lyrics
Bố mẹ à
Con đang đi hơi xa
Nhưng mà sau đêm nay
Con sẽ về nhà (Về nhà ăn Tết)
Thấy bảo chất (Uhm)
Chất thì sao phải khất? (Về nhà ăn Tết)
Biết là gấp
Cũng đừng vấp mặt xấp (Về nhà ăn Tết)
Double, double (Double)
Double đang lâm nguy (Về nhà ăn Tết)
Tây Hồ, Tây Hồ, Tây Hồ (Em yêu Big Daddy)
Về nhà ăn Tết
Nhưng mà khoan, chủ nợ cứ phải ngoan
Không được ngang, xem thái độ (Uhm)
Dù là thân con nợ nhưng cứ phải sang
Cứ phải có cái cớ thì mình mới nhớ được nhau nên
Anh em mình cứ trước lạ sau quên
Nên em để anh vào trong black list
Vì em không thích nói chuyện qua loa
Quyết tâm bước sang năm mới làm ăn phải phất
Để cho chủ nợ không nhận ra ta
Con nợ xa hoa, con nợ chất
Cổ tay lấp lánh Cartier
Biến con bò trong chuồng thành con Lamborghini
Ví đầy up chuyển tiền về quê

Ngọc ngà ruby thì ta đâu dám so
Vẫn đứng vô lo, giữa những cam go
Chân đi đất, trên đội trời
Hiên ngang anh chấp luôn bao dân chơi
Dollar cả xấp mà không tăm hơi
Thua xa một cắc anh trao kịp thời (Right?)
JustaTee
]
(Về nhà ăn Tết)
Một cắc, một cắc, anh lắc
Đủ ấm cả thân
(Về nhà ăn Tết)
Một cắc, một cắc, anh lắc
Đầy ắp cả mâm
(Về nhà ăn Tết)
Một cắc, một cắc, anh lắc
Đào quất đầy sân
(Về nhà ăn Tết)
Một cắc, một cắc, anh lắc
Bật nhạc anh lắc cả xuân
(Về nhà ăn Tết)
Một cắc, một cắc, anh lắc
Đủ ấm cả thân
(Về nhà ăn Tết)
Một cắc, một cắc, anh lắc
Đầy ắp cả mâm
(Về nhà ăn Tết)
Một cắc, một cắc, anh lắc
Đào quất đầy sân
(Về nhà ăn Tết)
Một cắc, một cắc, anh lắc
Bật nhạc anh lắc cả xuân

Hạ thu sang đông chẳng thấy bạn hỏi
Gọi bạn là bạn né
Xuân này tôi cũng mạnh giỏi
Bạn lại gọi bảo mãi bên nhau bạn nhé
Tết này chắc khác Tết xưa
Ơ tôi kể bạn biết chưa?
Khu mình cũng có Viettel Money
Nên tài khoản ai cũng hơi thừa
Về nhà ăn Tết
Thế mà em út nó chăn hết
Có thằng em họ đang căng đét
Bị dí nhiều trán nó lại nhăn phết
Gia đình vẫn quây quần và khăng khít
Không rời xa như thời Covid
Quân số thêm vài đứa lít nhít
Có lì xì là cười tít mít
JustaTee
]
(Về nhà ăn Tết)
Một cắc, một cắc, anh lắc
Đủ ấm cả thân
(Về nhà ăn Tết)
Một cắc, một cắc, anh lắc
Đầy ắp cả mâm
(Về nhà ăn Tết)
Một cắc, một cắc, anh lắc
Đào quất đầy sân
(Về nhà ăn Tết)
Một cắc, một cắc, anh lắc
Bật nhạc anh lắc cả xuân

with BigDaddy
]
Châm ngôn là thế, thôi đừng vẽ chốn xa vời
Mâm son này dễ, Tết này bẽ nhất trên đời
Tiền thì là giấy, mà không một ai cho ta lấy
Để số dư nay chẳng khác gì với chiều cao ta là mấy
Ngọc ngà ruby thì ta đâu dám so
Vẫn đứng vô lo, giữa những cam go
Chân đi đất, trên đội trời
Hiên ngang anh chấp luôn bao dân chơi
Dollar cả xấp mà không tăm hơi
Thua xa một cắc anh trao kịp thời (Right?)
JustaTee
]
(Về nhà ăn Tết)
Một cắc, một cắc, anh lắc
Đủ ấm cả thân
(Về nhà ăn Tết)
Một cắc, một cắc, anh lắc
Đầy ắp cả mâm
(Về nhà ăn Tết)
Một cắc, một cắc, anh lắc
Đào quất đầy sân
(Về nhà ăn Tết)
Một cắc, một cắc, anh lắc
Bật nhạc anh lắc cả xuân
(Về nhà ăn Tết)
Một cắc, một cắc, anh lắc
Đủ ấm cả thân
(Về nhà ăn Tết)
Một cắc, một cắc, anh lắc
Đầy ắp cả mâm
(Về nhà ăn Tết)
Một cắc, một cắc, anh lắc
Đào quất đầy sân
(Về nhà ăn Tết)
Một cắc, một cắc, anh lắc
Bật nhạc anh lắc cả xuân"
TflBvOFixX4,Đánh Mất - Đàm Vĩnh Hưng,Đánh Mất,HUU LOI PHAM,"4 Contributors
Vừa Tìm Thấy Đã Đánh Mất Lyrics
Ngày mà em tới
Tia nắng vẫn nhẹ thế thôi
Nhưng khóe môi em sưởi ấm tim tôi
Chợt yêu mất rồi
Chợt ôm những nhớ thương mong manh ngày em tới, uh-huh-huh
Thì ra trăng tròn thế thôi
Soi sáng câu hẹn thề ước chung đôi
Mà chẳng ai cất lời, bỏ lại đằng sau những mông lung
Vào đêm cuối, nhìn em rời
Dìu nàng về gần nhà, đến đây thôi
Và nếu lúc đó ta không ngại, không ngơ ngác, lăn tăn, thờ ơ
Sao ta vẫn còn ngây thơ?
Vừa tìm thấy đã đánh mất
Mơ một chốc đã thức giấc
Tiếng yêu thương nay không cất lên thành câu
Có em một phút nhưng lại lỡ em cả đời
Bóng em thả trôi để dòng người thành hư vô
Vừa tìm thấy đã đánh mất
Chưa kịp trao em tâm tư
Nắm tay em nhưng có giữ em được đâu?
Vấn vương còn đó nhưng chẳng có câu trả lời
Thì vậy thôi, và cứ thế, mình đành chơi vơi

Tựa như ta chưa bắt đầu
Nắng vẫn long lanh bên hiên nhà anh
Mây vẫn trôi bồng bềnh giống bao ngày
Mà sao thế này?
Thấy đôi tay mình thêm nâng niu những niềm vui mơ hồ
Mới ngay đây thôi nhưng sao lại thôi?
Sao áng mây mang vệt nắng đi rồi?
Bỏ rơi mối tình, lửng lơ những bối rối ngây ngô
Vào đêm cuối (Vào đêm cuối), nhìn em rời
Dìu nàng về gần nhà, đến đây thôi
Và nếu biết trước mai không còn
Anh sẽ đứng ôm em thật lâu, hôn thật sâu (Nếu em tin vào những thứ vớ vẩn)
Để khóa lấy những thứ thuộc về nhau
Vừa tìm thấy đã đánh mất
Mơ một chốc đã thức giấc
Tiếng yêu thương nay không cất lên thành câu
Có em một phút nhưng đã lỡ em cả đời
Bóng em thả trôi để dòng người thành hư vô
Vừa tìm thấy đã đánh mất
Chưa kịp trao em tâm tư
Nắm tay em nhưng có giữ em được đâu?
Chúng ta vừa hữu duyên mà trót vô phận rồi
Thì vậy thôi, và cứ thế, mình đành chia đôi"
2QZDyIFVHWg,"Giám khảo Phi Nhung, Giám khảo Mạnh Quỳnh | Solo cùng Bolero Mùa 6 - Tập 18: Ngợi ca quê hương",Ngợi ca quê hương,THVL Giải Trí,"1 Contributor
Ngợi Ca Quê Hương Em Lyrics
(Ha-ah-ah-ah-ah-ah-ah-ah-ah-ah-ah-ah-ah)
(Ha-ah-ah-ah-ah-ah)
(Ha-ah-ah-ah-ah-ah-ah-ah-ah-ah)
(Ha, ha)
Như bức họa tình ca trên lúa
Nghe thoáng xa tiếng hò vọng đưa
Vài thôn nữ hát đưa duyên ngày mùa
Hạt lúa chín đã nuôi ta ngàn xưa 
(Ha-ha-ha-ha-ha-ha)
Con nước ròng rồi con nước lớn 
(Rồi con nước lớn)
Anh với em ở cùng một thôn
Thời gian đã bước chân quen đường mòn
Lòng mơ ước hai đứa vui duyên tròn
(Lòng mơ ước hai đứa vui duyên tròn)
Ơi những giọt mồ hôi tưới lên đời cuộc sống
Quê hương em có chín dòng sông
Như chín con rồng tên gọi Cửu Long 
(Như chín con-)
Thuyền ngược xuôi cập bến Sóc Trăng, Cần Thơ
Đẹp lắm những đêm trăng mờ gởi lòng người nhớ
(Ha-ha-ha-ha-ha-ha-ha)

Hương lúa ngọt tình quê lai láng
Anh với em chẳng cần giàu sang
Còn thương mãi lũy tre xanh quanh làng
Làm bóng mát hát ru câu tình ca 
(Ru hát tình ca, ah)
Lâu lắm rồi chờ nhau thương quá
Em có nghe những lời ngợi ca
Giọt nước mắt khóc thay cho nụ cười
Tình yêu đó dâng hiến cho hai người
(Tình yêu đó dâng hiến cho hai người)
(Ha-ah-ah-ah-ah-ah-ah-ah-ah-ah-ah-ah-ah)
(Ha-ah-ah-ah-ah-ah)
(Ha-ah-ah-ah-ah-ah-ah)
(Ha, ha)
(Ha, ha)
Ơi những giọt mồ hôi tưới lên đời cuộc sống 
(Lên đời cuộc sống)
Quê hương em có chín dòng sông
Như chín con rồng tên gọi Cửu Long 
(Như chín con-)
Thuyền ngược xuôi cập bến Sóc Trăng, Cần Thơ
Đẹp lắm những đêm trăng mờ gởi lòng người nhớ
(Ha-ha-ha-ha-ha-ha-ha)

Hương lúa ngọt tình quê lai láng
Anh với em chẳng cần giàu sang 
(Chẳng cần giàu sang)
Còn thương mãi lũy tre xanh quanh làng
Làm bóng mát hát ru câu tình ca 
(Ru hát tình ca, ah)
Lâu lắm rồi chờ nhau thương quá
Em có nghe những lời ngợi ca 
(Những lời ngợi ca)
Giọt nước mắt khóc thay cho nụ cười
Tình yêu đó dâng hiến cho hai người
(Tình yêu đó dâng hiến cho hai người)
Giọt nước mắt khóc thay cho nụ cười
Tình yêu đó dâng hiến cho hai người
(Ha-ha-ha-ha)
(Ha-ha-ha-ha)
(Ha-ha-ha)"
MwnWiHBR-yw,TÍNH LƯỜI - JSOL ft. HURRYKNG | OFFICIAL MV,TÍNH LƯỜI,DreamS Entertainment,"1 Contributor
TÍNH LƯỜI Lyrics
Chào buổi sáng!
Mình cơm nước gì chưa người đẹp?
Vừa mở mắt, là chờ tin nhắn của em
Vang lên như thói quen
Chẳng cần cà phê, chẳng cần ăn sáng
Nghĩ về em cũng no rồi!
Là em đấy! Always you!
Làm anh phát điên lên mỗi ngày
Baby em thật biết cách trêu đùa
Xoay anh như là chong chóng quay
Ô kê anh chạy qua đón em liền
Lên xe anh ngay!
Thực ra anh là tính lười
Nhưng gặp em lại rơi vào lưới tình
Chẳng thể bó tay đứng yên khi mà
Con tim anh đang lên tiếng
Thực ra đây là ý trời
Hay là em lừa anh vào lưới tình
Mặc kệ mình cứ lao lao lao vào
I want you now now now now... yeah!
Babeeee, I will do for you
Don't be lazeeeee
Yeah I do everything for you
Ey, drop con beat để anh phiêu
Ver này xong là em yêu
Em là ngôi sao, em là minh tinh
Aphrodite!
Định nghĩa tình yêu là do em phát minh
Ting ting ting!
Phone rung lên là tim anh rung rinh
You're my queen, I'm your king
Trong thế giới của anh
Em là nhân vật chính
Baby cứ gọi anh lúc 2 giờ
Yên tâm anh còn đang thức đây
Ô kê anh chạy qua đón em liền
Lên xe anh ngay!
Thực ra anh là tính lười
Nhưng gặp em lại rơi vào lưới tình
Chẳng thể bó tay đứng yên khi mà
Con tim anh đang lên tiếng
Thực ra đây là ý trời
Hay là em lừa anh vào lưới tình
Mặc kệ mình cứ lao lao lao vào
I want you now now now now... yeah!
Babeeee, I will do for you
Don't be lazeeeee
Yeah I do everything for you
Babeeee, I will do for you
Don't be lazeeeee
Yeah I do everything for you
Mơ cao và có cái tính lười
Anh 2 3 nhưng thích người 9 10
Trong mắt chẳng có ai xinh tươi
Tin vui gặp em anh dính mồi
Nhưng anh vờ như anh cũng chẳng tham lam đến thế
Trong đầu thì phát điên như tên hề
Nghĩ là muốn anh yêu chẳng dễ
Em cười đi! Whoops!!
Thôi xong! Anh thề
Anh có thể hái mớ sao trên cao kia em có thấy oke không?
Hay là sáng tối trưa chờ em dù mưa hay nắng oke không?
Vầy đủ cháy chưa hay thôi anh lao luôn vào lửa đi cho xong
I can over do whatever
I can do for you too
Yêu em dẫu đường xa lắm quanh co
Yêu em anh chẳng cần lý do
Ô kê anh chạy qua đón em liền
Lên xe anh ngay!
Thực ra anh là tính lười
Nhưng gặp em lại rơi vào lưới tình
Chẳng thể bó tay đứng yên khi mà
Con tim anh đang lên tiếng
Thực ra đây là ý trời
Hay là em lừa anh vào lưới tình
Mặc kệ mình cứ lao lao lao vào
I want you now now now now... yeah!
Babeeee, I will do for you
Don't be lazeeeee
Yeah I do everything for you
Babeeee, I will do for you
Don't be lazeeeee
Yeah I do everything for you"
J6E5IWY6bac,OST Gạo Nếp Gạo Tẻ | Đi Tìm Tình Yêu - Ôn Vĩnh Quang | Lyrics Video,Đi Tìm Tình Yêu,Gác Xép Chill,"4 Contributors
Đi Tìm Tình Yêu Lyrics
Anh cứ loay hoay đi tìm tình yêu, nóng như bị lửa thiêu
Chân đau, người liêu xiêu
Lang thang thật cô liêu, xong bắt xe đi xuống tận Bạc Liêu
Hết cả tiền để tiêu vẫn chẳng có một ai yêu (Buồn!)
Chạy dọc cả Bắc Nam mà chẳng thấy bóng cô nào
Lật đật về chốn xưa, tìm mối cũ gửi lời chào
Thế nhưng em đã có chồng (Bị sốc!)
Oh, baby ơi, anh đau lòng (Như thằng ngốc)
Tìm một cô gái đáng yêu, đáng yêu
Rất đáng yêu, đáng yêu, dễ nuông chiều, nuông chiều
Không cần nói quá nhiều, mà vẫn biết-biết-biết-biết điều, biết điều
Chắc cốp thì phải đánh bắt thật xa, biết đâu lại vớ được tình yêu?
Sinh ra cho đến bây giờ, chưa một mối tình duyên nợ
Thầy bu thì trông chờ, mong cậu quý tử lấy vợ
Gấp lắm rồi (Lắm rồi, lắm rồi, lắm rồi)
Có anh là đời em như là văn, như là thơ
Anh đi tìm em, em lại trốn, như bịt mắt bắt dê vậy
Anh đi tìm em, em lại trốn, như bịt mắt bắt dê vậy
Biết đi tìm em ở chốn nào? Ooh-ooh-ooh
Biết đi tìm em ở chốn nào?

Anh phóng công nông sang tận miền Đông (Xời!)
Chân mang vội đôi tông, ah, ngắm xem còn ai không, ah
Thấy cô nàng chăm chú ăn trái thanh long bên cạnh bờ sông
Đánh má hồng lệch tone, mà thôi, có vẫn còn hơn không (Thật á!?)
Loạng choạng anh bắt em về làm dâu cả trăm họ
Chạng vạng mình ngắm mây rồi ngâm thêm mấy câu quan họ
Bố mẹ anh muốn bế cháu rồi (Cháu nội) (Í a, í oh)
Một gái, một trai thì vui, ối dồi! (Tuyệt vời!) (Tuyệt vời, em ơi!)
Tìm một cô gái đáng yêu, đáng yêu
Rất đáng yêu, đáng yêu, dễ nuông chiều, nuông chiều
Không cần nói quá nhiều, mà vẫn biết-biết-biết-biết điều, biết điều
Chắc cốp thì phải đánh bắt thật xa, biết đâu lại vớ được tình yêu?
Sinh ra cho đến bây giờ, chưa một mối tình duyên nợ
Thầy bu thì trông chờ, mong cậu quý tử lấy vợ
Gấp lắm rồi (Lắm rồi, lắm rồi, lắm rồi)
Có anh là đời em như là văn, như là thơ
Anh cứ loay hoay
Tìm một cô gái
(Tình yêu, cô gái)
Một mái ấm, đó là ước mơ của anh

Anh đi tìm em (Hey! Hey! Yes, sir!)
Em lại trốn, như bịt mắt bắt dê vậy (Hey! Hey! Woah!)
Anh đi tìm em (Hey! Hey! Hey!)
Em lại trốn, như bịt mắt bắt dê vậy (Hey! Hey! Hey! Hey! Hey!)
Biết đi tìm em ở chốn nào? Ooh-ooh-ooh
Biết đi tìm em ở chốn nào? (Biết đi—, biết đi—, biết đi đâu?)
Anh cứ loay hoay —"
OhS9QS_rLWM,Giá Như Mình Đã Bao Dung - Hồ Ngọc Hà | Gala Nhạc Việt 12,,Gala Nhạc Việt,"19 người đóng góp
Bản dịch
tiếng Nhật
RADWIMPS - Nandemonaiya (Phiên bản phim) (La Mã) Lời bài hát
Futari no aida toorisugita kaze wa
Doko kara sabishisa wo hakondekita no
Naitari shita sono ato no sora wa
Yake ni sukitootteitari shitanda
Itsumo wa togatte tachichi no kotoba ga
Kyou wa atatakaku kanjimashita
Yasashisa mo egao mo yume no katarikata mo
Shiranakute zenbu kimi wo maneta yo
Mou sukoshi dake de ii ato sukoshi dake de ii
Mou sukoshi dake de ii kara
Mou sukoshi dake de ii ato sukoshi dake de ii
Mou sukoshi dake kuttsuiteiyou ka
Bokura taimufuraiyaa toki wo kakeagaru kuraima
Toki no kakurenbo hagurekko wa mou iya nanda
Ureshikute naku nowa kanashikute warau bây giờ
Kimi no kokoro ga kimi wo oikoshitanda yo
Hoshi ni made negatte te ni ireta omocha mo
Heya no sumikko ni ima korogatteru
Kanaetai yume mo kyou de hyakko dekita yo
Tatta hitotsu to itsuka koukanko shiyou
Itsumo wa shaberanai ano ko ni kyou wa
Houkago ""mata ashita"" to koe wo kaketa
Narenai koto mo tama ni nara ii ne
Toku ni anata ga tonari ni itara

Mou sukoshi dake de ii ato sukoshi dake de ii
Mou sukoshi dake de ii kara
Mou sukoshi dake de ii ato sukoshi dake de ii
Mou sukoshi dake kuttsuiteiyou yo
Bokura taimufuraiyaa kimi wo shitteitanda
Boku ga boku no namae wo oboeru yori zutto mae ni
Kimi no inai sekai ni mo
Nanika no imi wa kitto atte
Demo kimi no inai sekai nado
natsuyasumi no nai hachigatsu không bạn
Kimi no inai sekai nado
Warau koto nai santa no you
Kimi no inai sekai nado
Bokura taimufuraiyaa toki wo kakeagaru kuraimaa
Toki no kakurenbo hagurekko wa mou iya nanda
Nandemo nai ya yappari nandemo nai ya
Ima kara iku yo
Bokura taimufuraiyaa toki wo kakeagaru kuraimaa
Toki no kakurenbo hagurekko wa mou ii yo
Kimi wa hade na kuraiyaa sono namida tometemitai na
Dakedo kimi wa kobanda
Koboreru mama no namida wo mite wakatta
Ureshikute naku no wa kanashikute warau nowa
Boku no kokoro ga boku wo oikoshitanda yo"
hH7uvZfyEZ8,CẦU VỒNG LẤP LÁNH - CHỊ ĐẸP DƯƠNG HOÀNG YẾN (Tiết Mục Solo) | CHỊ ĐẸP ĐẠP GIÓ 2024,CẦU VỒNG LẤP LÁNH,YEAH1 MUSIC,"2 Contributors
Cầu Vồng Lấp Lánh Lyrics
(Just make a dancing)
(We try)
Vì em luôn tin sau cơn mưa cầu vồng sẽ lấp lánh
Những tổn thương đi qua em dịu dàng dệt nên đôi cánh
Vút bay lên những làn gió, làn gió, vượt ngàn sóng, ngàn sóng
Đi qua chênh vênh để tìm thấy
Trái tim em huy hoàng
Đã từng nhiều lần chùn bước (Chùn bước)
Đã từng nhiều lần bật khóc (Bật khóc)
Cứ ngỡ sẽ suốt đời living like a loser
Tìm hoài chẳng được điểm đến (Điểm đến)
Chờ hoài chẳng được gọi tên (Gọi tên)
Chẳng dám ước mơ, nói gì đến rực rỡ
You only lose when you give up, babe
Only when you want to give up, babe
Đường dài sẽ thật khó đi, thành bại nếu ta kiên trì (Ooh-ooh)
Nâng ly đêm nay and we start (Start, ah-ah-ah-ah)

Văn Mai Hương
]
Vì em luôn tin sau cơn mưa cầu vồng sẽ lấp lánh
Những tổn thương đi qua em dịu dàng dệt nên đôi cánh
Vút bay lên những làn gió, làn gió, vượt ngàn sóng, ngàn sóng
Đi qua chênh vênh để tìm thấy
Chẳng còn điều gì có thể làm một người từng ngã đau
Sẽ ngã đau thêm một lần, vực dậy từ nơi hố sâu
Dẫu vết thương nơi em trầy xước, trầy xước, chẳng lùi bước, lùi bước
Quên đi em yếu đuối đã xa
Trái tim em huy hoàng
No matter who you are, just shinin' like a star
'Cause everybody wanna make it, la-la-la
Chỉ cần chẳng ngừng mộng mơ (ooh-ooh), cầu vồng rồi sẽ rực rỡ (Rực rỡ)
Red and orange, yellow, green, blue, violet
You only lose when you give up, babe
Only when you want to give up, babe
Đường dài sẽ thật khó đi, thành bại nếu ta kiên trì (Ooh-ooh)
Nâng ly đêm nay and we start
Myra Trần
]
Vì em luôn tin sau cơn mưa, cầu vồng sẽ lấp lánh
Những tổn thương đi qua em dịu dàng dệt nên đôi cánh
Vút bay lên những làn gió, làn gió, vượt ngàn sóng, ngàn sóng
Đi qua chênh vênh để tìm thấy
Chẳng còn điều gì có thể làm một người từng ngã đau
Sẽ ngã đau thêm một lần, vực dậy từ nơi hố sâu
Dẫu vết thương nơi еm trầy xước, trầy xước, chẳng lùi bước, lùi bước
Quên đi em yếu đuối đã xa
Trái tim em huy hoàng

Văn Mai Hương
]
Whoo, pa-da-pa-pa-pa
Whoo-whoo-whoo-ah-hah-ah-hah-ah-hey-hеy, oh-oh-oh 
(Ooh-ooh-ooh-ooh)
Hoh-ooh-oh
Myra Trần
]
Trái tim em huy hoàng 
(Trái tim em huy hoàng)
Cầu vồng thật lấp lánh 
(Cầu vồng thật lấp lánh)
Trái tim em huy hoàng 
(Trái tim em huy hoàng)
Cầu vồng thật lấp lánh 
(Ah-y-yeah-y-yeah-y-yeah)"
